### ISSUE TITLE
Libreswan: hostNetwork on GW to remote pod fails

### ISSUE THREAD

**Issue by mangelajo** [submariner-io/submariner#592]
**What happened**:  On the PR for libreswan, that specific scenario fails.

**What you expected to happen**: the e2e test to pass

**How to reproduce it (as minimally and precisely as possible)**:
Just run the e2e tests with libreswan cabledriver.

**Anything else we need to know?**:

**Environment**:

`make e2e DEPLOY_ARGS="--deploytool operator --deploytool_submariner_args '--cable-driver libreswan'"`

[dataplane] Basic TCP connectivity tests across clusters without discovery when a pod with [hostnetworking] connects via TCP to a remote pod when the pod is on a gateway and the remote pod is not on a gateway 
  should have sent the expected data from the pod to the other pod
  /go/src/github.com/submariner-io/submariner/test/e2e/dataplane/tcp_pod_connectivity.go:15
STEP: Creating namespace objects with basename "dataplane-conn-nd"
STEP: Generated namespace "e2e-tests-dataplane-conn-nd-2g76w" in cluster "cluster2" to execute the tests in
STEP: Creating namespace "e2e-tests-dataplane-conn-nd-2g76w" in cluster "cluster3"
STEP: Creating namespace "e2e-tests-dataplane-conn-nd-2g76w" in cluster "cluster1"
STEP: Creating a listener pod in cluster "cluster3", which will wait for a handshake over TCP
May 25 11:47:16.264: INFO: Will send traffic to IP: 10.243.128.2
STEP: Creating a connector pod in cluster "cluster2", which will attempt the specific UUID handshake over TCP
STEP: Waiting for the listener pod "tcp-check-listenerl999g" to exit, returning what listener sent
STEP: Waiting for the connector pod "tcp-check-podtdd42" to exit, returning what connector sent
May 25 11:49:26.341: INFO: Pod "tcp-check-podtdd42" output:
nc: 10.243.128.2 (10.243.128.2:1234): Connection timed out
nc: 10.243.128.2 (10.243.128.2:1234): Connection timed out
nc: 10.243.128.2 (10.243.128.2:1234): Connection timed out
nc: 10.243.128.2 (10.243.128.2:1234): Connection timed out
nc: 10.243.128.2 (10.243.128.2:1234): Connection timed out
nc: 10.243.128.2 (10.243.128.2:1234): Connection timed out
nc: 10.243.128.2 (10.243.128.2:1234): Connection timed out

May 25 11:49:26.341: INFO: Connector pod has IP: 172.17.0.9
STEP: Deleting namespace "e2e-tests-dataplane-conn-nd-2g76w" on cluster "cluster2"
STEP: Deleting namespace "e2e-tests-dataplane-conn-nd-2g76w" on cluster "cluster3"
STEP: Deleting namespace "e2e-tests-dataplane-conn-nd-2g76w" on cluster "cluster1"

• Failure [135.175 seconds]
[dataplane] Basic TCP connectivity tests across clusters without discovery
/go/src/github.com/submariner-io/submariner/test/e2e/dataplane/tcp_pod_connectivity.go:9
  when a pod with [hostnetworking] connects via TCP to a remote pod
  /go/src/github.com/submariner-io/submariner/test/e2e/dataplane/tcp_pod_connectivity.go:78
    when the pod is on a gateway and the remote pod is not on a gateway
    /go/src/github.com/submariner-io/submariner/test/e2e/dataplane/tcp_pod_connectivity.go:88
      should have sent the expected data from the pod to the other pod [It]
      /go/src/github.com/submariner-io/submariner/test/e2e/dataplane/tcp_pod_connectivity.go:15

      Failed to await pod "tcp-check-listenerl999g" finished. Pod status is Running
      Unexpected error:
          <*errors.errorString | 0xc00024e0d0>: {
              s: "timed out waiting for the condition",
          }
          timed out waiting for the condition
      occurred

      /go/src/github.com/submariner-io/submariner/vendor/github.com/submariner-io/shipyard/test/e2e/framework/network_pods.go:138

**Comment by mangelajo** [comment]
When I try to ping from the gateway into a pod it wont work. It will try to drop the packet right away on eth0.

```
 [root@cluster2-worker submariner]# ip r show table all
default via 172.17.0.1 dev eth0 
10.242.0.0/16 dev weave proto kernel scope link src 10.242.96.0 
172.17.0.0/16 dev eth0 proto kernel scope link src 172.17.0.9 
240.0.0.0/8 dev vx-submariner proto kernel scope link src 240.17.0.9 
broadcast 10.242.0.0 dev weave table local proto kernel scope link src 10.242.96.0 
local 10.242.96.0 dev weave table local proto kernel scope host src 10.242.96.0 
broadcast 10.242.255.255 dev weave table local proto kernel scope link src 10.242.96.0 
broadcast 127.0.0.0 dev lo table local proto kernel scope link src 127.0.0.1 
local 127.0.0.0/8 dev lo table local proto kernel scope host src 127.0.0.1 
local 127.0.0.1 dev lo table local proto kernel scope host src 127.0.0.1 
broadcast 127.255.255.255 dev lo table local proto kernel scope link src 127.0.0.1 
broadcast 172.17.0.0 dev eth0 table local proto kernel scope link src 172.17.0.9 
local 172.17.0.9 dev eth0 table local proto kernel scope host src 172.17.0.9 
broadcast 172.17.255.255 dev eth0 table local proto kernel scope link src 172.17.0.9 
broadcast 240.0.0.0 dev vx-submariner table local proto kernel scope link src 240.17.0.9 
local 240.17.0.9 dev vx-submariner table local proto kernel scope host src 240.17.0.9 
broadcast 240.255.255.255 dev vx-submariner table local proto kernel scope link src 240.17.0.9 

```

This is how the xfrm policies look in libreswan:

```
[root@cluster2-worker submariner]# ip xfrm policy
src 100.92.0.0/16 dst 100.93.0.0/16 
	dir out priority 2088926 ptype main 
	tmpl src 172.17.0.9 dst 172.17.0.7
		proto esp reqid 16405 mode tunnel
src 10.242.0.0/16 dst 10.243.0.0/16 
	dir out priority 2088926 ptype main 
	tmpl src 172.17.0.9 dst 172.17.0.7
		proto esp reqid 16417 mode tunnel
src 10.243.0.0/16 dst 10.242.0.0/16 
	dir fwd priority 2088926 ptype main 
	tmpl src 172.17.0.7 dst 172.17.0.9
		proto esp reqid 16417 mode tunnel
src 10.243.0.0/16 dst 10.242.0.0/16 
	dir in priority 2088926 ptype main 
	tmpl src 172.17.0.7 dst 172.17.0.9
		proto esp reqid 16417 mode tunnel
src 100.92.0.0/16 dst 10.243.0.0/16 
	dir out priority 2088926 ptype main 
	tmpl src 172.17.0.9 dst 172.17.0.7
		proto esp reqid 16409 mode tunnel
src 10.243.0.0/16 dst 100.92.0.0/16 
	dir fwd priority 2088926 ptype main 
	tmpl src 172.17.0.7 dst 172.17.0.9
		proto esp reqid 16409 mode tunnel
src 10.243.0.0/16 dst 100.92.0.0/16 
	dir in priority 2088926 ptype main 
	tmpl src 172.17.0.7 dst 172.17.0.9
		proto esp reqid 16409 mode tunnel
src 10.242.0.0/16 dst 100.93.0.0/16 
	dir out priority 2088926 ptype main 
	tmpl src 172.17.0.9 dst 172.17.0.7
		proto esp reqid 16413 mode tunnel
src 100.93.0.0/16 dst 10.242.0.0/16 
	dir fwd priority 2088926 ptype main 
	tmpl src 172.17.0.7 dst 172.17.0.9
		proto esp reqid 16413 mode tunnel
src 100.93.0.0/16 dst 10.242.0.0/16 
	dir in priority 2088926 ptype main 
	tmpl src 172.17.0.7 dst 172.17.0.9
		proto esp reqid 16413 mode tunnel
src 100.93.0.0/16 dst 100.92.0.0/16 
	dir fwd priority 2088926 ptype main 
	tmpl src 172.17.0.7 dst 172.17.0.9
		proto esp reqid 16405 mode tunnel
src 100.93.0.0/16 dst 100.92.0.0/16 
	dir in priority 2088926 ptype main 
	tmpl src 172.17.0.7 dst 172.17.0.9
		proto esp reqid 16405 mode tunnel
src 10.242.0.0/16 dst 10.241.0.0/16 
	dir out priority 2088926 ptype main 
	tmpl src 172.17.0.9 dst 172.17.0.5
		proto esp reqid 16401 mode tunnel
src 10.241.0.0/16 dst 10.242.0.0/16 
	dir fwd priority 2088926 ptype main 
	tmpl src 172.17.0.5 dst 172.17.0.9
		proto esp reqid 16401 mode tunnel
src 10.241.0.0/16 dst 10.242.0.0/16 
	dir in priority 2088926 ptype main 
	tmpl src 172.17.0.5 dst 172.17.0.9
		proto esp reqid 16401 mode tunnel
src 10.242.0.0/16 dst 100.91.0.0/16 
	dir out priority 2088926 ptype main 
	tmpl src 172.17.0.9 dst 172.17.0.5
		proto esp reqid 16397 mode tunnel
src 100.91.0.0/16 dst 10.242.0.0/16 
	dir fwd priority 2088926 ptype main 
	tmpl src 172.17.0.5 dst 172.17.0.9
		proto esp reqid 16397 mode tunnel
src 100.91.0.0/16 dst 10.242.0.0/16 
	dir in priority 2088926 ptype main 
	tmpl src 172.17.0.5 dst 172.17.0.9
		proto esp reqid 16397 mode tunnel
src 100.92.0.0/16 dst 10.241.0.0/16 
	dir out priority 2088926 ptype main 
	tmpl src 172.17.0.9 dst 172.17.0.5
		proto esp reqid 16393 mode tunnel
src 10.241.0.0/16 dst 100.92.0.0/16 
	dir fwd priority 2088926 ptype main 
	tmpl src 172.17.0.5 dst 172.17.0.9
		proto esp reqid 16393 mode tunnel
src 10.241.0.0/16 dst 100.92.0.0/16 
	dir in priority 2088926 ptype main 
	tmpl src 172.17.0.5 dst 172.17.0.9
		proto esp reqid 16393 mode tunnel
src 100.92.0.0/16 dst 100.91.0.0/16 
	dir out priority 2088926 ptype main 
	tmpl src 172.17.0.9 dst 172.17.0.5
		proto esp reqid 16389 mode tunnel
src 100.91.0.0/16 dst 100.92.0.0/16 
	dir fwd priority 2088926 ptype main 
	tmpl src 172.17.0.5 dst 172.17.0.9
		proto esp reqid 16389 mode tunnel
src 100.91.0.0/16 dst 100.92.0.0/16 
	dir in priority 2088926 ptype main 
	tmpl src 172.17.0.5 dst 172.17.0.9
		proto esp reqid 16389 mode tunnel
src 0.0.0.0/0 dst 0.0.0.0/0 
	socket out priority 0 ptype main 
src 0.0.0.0/0 dst 0.0.0.0/0 
	socket in priority 0 ptype main 
src 0.0.0.0/0 dst 0.0.0.0/0 
	socket out priority 0 ptype main 
src 0.0.0.0/0 dst 0.0.0.0/0 
	socket in priority 0 ptype main 
src 0.0.0.0/0 dst 0.0.0.0/0 
	socket out priority 0 ptype main 
src 0.0.0.0/0 dst 0.0.0.0/0 
	socket in priority 0 ptype main 
src 0.0.0.0/0 dst 0.0.0.0/0 
	socket out priority 0 ptype main 
src 0.0.0.0/0 dst 0.0.0.0/0 
	socket in priority 0 ptype main 
src 0.0.0.0/0 dst 0.0.0.0/0 
	socket out priority 0 ptype main 
src 0.0.0.0/0 dst 0.0.0.0/0 
	socket in priority 0 ptype main 
src 0.0.0.0/0 dst 0.0.0.0/0 
	socket out priority 0 ptype main 
src 0.0.0.0/0 dst 0.0.0.0/0 
	socket in priority 0 ptype main 
src 0.0.0.0/0 dst 0.0.0.0/0 
	socket out priority 0 ptype main 
src 0.0.0.0/0 dst 0.0.0.0/0 
	socket in priority 0 ptype main 
src 0.0.0.0/0 dst 0.0.0.0/0 
	socket out priority 0 ptype main 
src 0.0.0.0/0 dst 0.0.0.0/0 
	socket in priority 0 ptype main 


```

xfrm state: 

```
# ip xfrm state
src 172.17.0.7 dst 172.17.0.9
	proto esp spi 0x616d5ba5 reqid 16405 mode tunnel
	replay-window 32 flag af-unspec
	aead rfc4106(gcm(aes)) 0x7b2f8376c140f4a456532ea08088b81027fb8f7cd4e06a8b73d19fae465aff4330c3c675 128
	anti-replay context: seq 0x0, oseq 0x0, bitmap 0x00000000
src 172.17.0.9 dst 172.17.0.7
	proto esp spi 0xb91958bd reqid 16405 mode tunnel
	replay-window 32 flag af-unspec
	aead rfc4106(gcm(aes)) 0x9e3079526697d0465ce723a72388fbc8d0c3e4cc957fbb892d003b8590043a886664e83c 128
	anti-replay context: seq 0x0, oseq 0x0, bitmap 0x00000000
src 172.17.0.7 dst 172.17.0.9
	proto esp spi 0x746f8059 reqid 16417 mode tunnel
	replay-window 32 flag af-unspec
	aead rfc4106(gcm(aes)) 0xbb8305fcb4403f01bf0085463835d0794feeee91c96da27530a5b728f74bee8be97d7879 128
	anti-replay context: seq 0x0, oseq 0x0, bitmap 0x00000000
src 172.17.0.9 dst 172.17.0.7
	proto esp spi 0x3b07ab2a reqid 16417 mode tunnel
	replay-window 32 flag af-unspec
	aead rfc4106(gcm(aes)) 0xafae56d6567f148c83aa845eba43deb6437c4e482323a9798bcfaacf813040c8a68dd142 128
	anti-replay context: seq 0x0, oseq 0x0, bitmap 0x00000000
src 172.17.0.7 dst 172.17.0.9
	proto esp spi 0xe36557d0 reqid 16409 mode tunnel
	replay-window 32 flag af-unspec
	aead rfc4106(gcm(aes)) 0xafd3a641b2897fcab5cc8a7bdbbd7c468ae4e513a7298b6285b3447226859a7f3e819ed6 128
	anti-replay context: seq 0x0, oseq 0x0, bitmap 0x00000000
src 172.17.0.9 dst 172.17.0.7
	proto esp spi 0x6de658b0 reqid 16409 mode tunnel
	replay-window 32 flag af-unspec
	aead rfc4106(gcm(aes)) 0x8bac6c002d521d686f71dd19f8d01a81412cfbce05109ab20ffa209012542e7f61b2be5b 128
	anti-replay context: seq 0x0, oseq 0x0, bitmap 0x00000000
src 172.17.0.7 dst 172.17.0.9
	proto esp spi 0x71387bb5 reqid 16413 mode tunnel
	replay-window 32 flag af-unspec
	aead rfc4106(gcm(aes)) 0xc2bac853de53eac21d9d6b40e5b4f84f12b20b828264200d411ef207202aaddde3a23d7d 128
	anti-replay context: seq 0x0, oseq 0x0, bitmap 0x00000000
src 172.17.0.9 dst 172.17.0.7
	proto esp spi 0x00f0eb66 reqid 16413 mode tunnel
	replay-window 32 flag af-unspec
	aead rfc4106(gcm(aes)) 0x05712cad6c845db9cc44e46d35ddd6dcbb97e1afd72acd259ce3d28ab11cb0a78a331737 128
	anti-replay context: seq 0x0, oseq 0x0, bitmap 0x00000000
src 172.17.0.7 dst 172.17.0.9
	proto esp spi 0x37a1976f reqid 16405 mode tunnel
	replay-window 32 flag af-unspec
	aead rfc4106(gcm(aes)) 0xeb2e99484bb93133a611eb6ac8739b73856e993f838fab4d62e3dee55637d6bac08c8e1a 128
	anti-replay context: seq 0x0, oseq 0x0, bitmap 0x00000000
src 172.17.0.9 dst 172.17.0.7
	proto esp spi 0x5308a36a reqid 16405 mode tunnel
	replay-window 32 flag af-unspec
	aead rfc4106(gcm(aes)) 0xb18c6b7b98aa5a94af9aed8105da28c49ebd797383cfef9549afa002b3da19dd8d5adb67 128
	anti-replay context: seq 0x0, oseq 0x0, bitmap 0x00000000
src 172.17.0.5 dst 172.17.0.9
	proto esp spi 0x3e015f93 reqid 16401 mode tunnel
	replay-window 32 flag af-unspec
	aead rfc4106(gcm(aes)) 0xa8e9765ba12e425a22d90e1cde9b047a37527ecadbaf2749b89fff1d28fa608bce5a738e 128
	anti-replay context: seq 0x0, oseq 0x0, bitmap 0x00000000
src 172.17.0.9 dst 172.17.0.5
	proto esp spi 0x6da646d9 reqid 16401 mode tunnel
	replay-window 32 flag af-unspec
	aead rfc4106(gcm(aes)) 0xea5d055cae225fac9b40f0e536eb187c6ba331ba488258201f698cf87a4cc93fab4e7259 128
	anti-replay context: seq 0x0, oseq 0x0, bitmap 0x00000000
src 172.17.0.5 dst 172.17.0.9
	proto esp spi 0x00550c62 reqid 16397 mode tunnel
	replay-window 32 flag af-unspec
	aead rfc4106(gcm(aes)) 0xb73289b6c5c63f3d9daffd92f71dc9f73ecdc6efcc2bc83880df371a7973b11534d901a7 128
	anti-replay context: seq 0x0, oseq 0x0, bitmap 0x00000000
src 172.17.0.9 dst 172.17.0.5
	proto esp spi 0x1c1220fa reqid 16397 mode tunnel
	replay-window 32 flag af-unspec
	aead rfc4106(gcm(aes)) 0x82b78a6b0ee1c5e07c9e79f42fcee800e48b28a64c2b1e337b07e7280655189fdfb90bed 128
	anti-replay context: seq 0x0, oseq 0x0, bitmap 0x00000000
src 172.17.0.5 dst 172.17.0.9
	proto esp spi 0x82c0808d reqid 16393 mode tunnel
	replay-window 32 flag af-unspec
	aead rfc4106(gcm(aes)) 0x7152eec871655ce2101863c8efbb0d84ba3ba49662c77ad54e44936a071019ee28c177a5 128
	anti-replay context: seq 0x0, oseq 0x0, bitmap 0x00000000
src 172.17.0.9 dst 172.17.0.5
	proto esp spi 0xdaf0bec1 reqid 16393 mode tunnel
	replay-window 32 flag af-unspec
	aead rfc4106(gcm(aes)) 0x4d82640f5bc1ec7fdfc487818ddf121d448ddaa9467b76faf781bb0b81fb962b80270693 128
	anti-replay context: seq 0x0, oseq 0x0, bitmap 0x00000000
src 172.17.0.5 dst 172.17.0.9
	proto esp spi 0xc30df9f1 reqid 16389 mode tunnel
	replay-window 32 flag af-unspec
	aead rfc4106(gcm(aes)) 0x8291e0cdbf169e2b4471edbe4018f417a6939a16d44b1cc3647aed67adf009ed1d8bde8e 128
	anti-replay context: seq 0x0, oseq 0x0, bitmap 0x00000000
src 172.17.0.9 dst 172.17.0.5
	proto esp spi 0x2892175a reqid 16389 mode tunnel
	replay-window 32 flag af-unspec
	aead rfc4106(gcm(aes)) 0xa47a34c540e811a41c58154f6b862ddb187dbe762e457dfb0f4902716720fa9392d21c04 128
	anti-replay context: seq 0x0, oseq 0x0, bitmap 0x00000000

```



```
# ip rule list 
0:	from all lookup local
32766:	from all lookup main
32767:	from all lookup default
```

**Comment by mangelajo** [comment]
Ok, looking at how strongswan works, still I need to check how the ipsec xfrm and routing is set, but, I saw this when pinging from the GW hostNetwork on the remote side:

```
[root@cluster2-worker submariner]# ip a
4: weave: <BROADCAST,MULTICAST,UP,LOWER_UP> mtu 1376 qdisc noqueue state UP group default qlen 1000
    link/ether 06:ad:aa:22:af:22 brd ff:ff:ff:ff:ff:ff
    inet 10.242.0.1/16 brd 10.242.255.255 scope global weave

[root@cluster2-worker submariner]# ip r
default via 172.17.0.1 dev eth0 
10.242.0.0/16 dev weave proto kernel scope link src 10.242.0.1 
172.17.0.0/16 dev eth0 proto kernel scope link src 172.17.0.6 
240.0.0.0/8 dev vx-submariner proto kernel scope link src 240.17.0.6 

[root@cluster2-worker submariner]# ping 10.243.224.3
PING 10.243.224.3 (10.243.224.3) 56(84) bytes of data.
64 bytes from 10.243.224.3: icmp_seq=1 ttl=63 time=0.736 ms
64 bytes from 10.243.224.3: icmp_seq=2 ttl=63 time=0.497 ms
64 bytes from 10.243.224.3: icmp_seq=3 ttl=63 time=0.422 ms
```

Notice that the packet on the remote host is masqueraded into the cluster3 GW network-plugin ip: 10.243.0.1
```
bash-5.0# tcpdump -i eth0 -n
tcpdump: verbose output suppressed, use -v or -vv for full protocol decode
listening on eth0, link-type EN10MB (Ethernet), capture size 262144 bytes
16:34:47.465672 IP  > 10.243.224.3: ICMP echo request, id 112, seq 1, length 64
16:34:47.465755 IP 10.243.224.3 > 10.243.0.1: ICMP echo reply, id 112, seq 1, length 64
16:34:48.514014 IP 10.243.0.1 > 10.243.224.3: ICMP echo request, id 112, seq 2, length 64
16:34:48.514063 IP 10.243.224.3 > 10.243.0.1: ICMP echo reply, id 112, seq 2, length 64
```

**Comment by mangelajo** [comment]
Ok for **strongswan**:


```
[root@cluster2-worker submariner]# ip r show table all
10.241.0.0/16 via 172.17.0.11 dev eth0 table 220 proto static src 172.17.0.6 
10.243.0.0/16 via 172.17.0.5 dev eth0 table 220 proto static src 172.17.0.6 
100.91.0.0/16 via 172.17.0.11 dev eth0 table 220 proto static src 172.17.0.6 
100.93.0.0/16 via 172.17.0.5 dev eth0 table 220 proto static src 172.17.0.6 
172.17.0.5 via 172.17.0.5 dev eth0 table 220 proto static src 172.17.0.6 
172.17.0.11 via 172.17.0.11 dev eth0 table 220 proto static src 172.17.0.6 
default via 172.17.0.1 dev eth0 
10.242.0.0/16 dev weave proto kernel scope link src 10.242.0.1 
172.17.0.0/16 dev eth0 proto kernel scope link src 172.17.0.6 
240.0.0.0/8 dev vx-submariner proto kernel scope link src 240.17.0.6 
broadcast 10.242.0.0 dev weave table local proto kernel scope link src 10.242.0.1 
local 10.242.0.1 dev weave table local proto kernel scope host src 10.242.0.1 
broadcast 10.242.255.255 dev weave table local proto kernel scope link src 10.242.0.1 
broadcast 127.0.0.0 dev lo table local proto kernel scope link src 127.0.0.1 
local 127.0.0.0/8 dev lo table local proto kernel scope host src 127.0.0.1 
local 127.0.0.1 dev lo table local proto kernel scope host src 127.0.0.1 
broadcast 127.255.255.255 dev lo table local proto kernel scope link src 127.0.0.1 
broadcast 172.17.0.0 dev eth0 table local proto kernel scope link src 172.17.0.6 
local 172.17.0.6 dev eth0 table local proto kernel scope host src 172.17.0.6 
broadcast 172.17.255.255 dev eth0 table local proto kernel scope link src 172.17.0.6 
broadcast 240.0.0.0 dev vx-submariner table local proto kernel scope link src 240.17.0.6 
local 240.17.0.6 dev vx-submariner table local proto kernel scope host src 240.17.0.6 
broadcast 240.255.255.255 dev vx-submariner table local proto kernel scope link src 240.17.0.6 

```
```
[root@cluster2-worker submariner]# ip xfrm policy
src 172.17.0.6/32 dst 172.17.0.5/32 
	dir out priority 367231 ptype main 
	tmpl src 172.17.0.6 dst 172.17.0.5
		proto esp spi 0xc8809352 reqid 2 mode tunnel
src 172.17.0.5/32 dst 172.17.0.6/32 
	dir fwd priority 367231 ptype main 
	tmpl src 172.17.0.5 dst 172.17.0.6
		proto esp reqid 2 mode tunnel
src 172.17.0.5/32 dst 172.17.0.6/32 
	dir in priority 367231 ptype main 
	tmpl src 172.17.0.5 dst 172.17.0.6
		proto esp reqid 2 mode tunnel
src 172.17.0.6/32 dst 100.93.0.0/16 
	dir out priority 375423 ptype main 
	tmpl src 172.17.0.6 dst 172.17.0.5
		proto esp spi 0xc8809352 reqid 2 mode tunnel
src 100.93.0.0/16 dst 172.17.0.6/32 
	dir fwd priority 375423 ptype main 
	tmpl src 172.17.0.5 dst 172.17.0.6
		proto esp reqid 2 mode tunnel
src 100.93.0.0/16 dst 172.17.0.6/32 
	dir in priority 375423 ptype main 
	tmpl src 172.17.0.5 dst 172.17.0.6
		proto esp reqid 2 mode tunnel
src 172.17.0.6/32 dst 10.243.0.0/16 
	dir out priority 375423 ptype main 
	tmpl src 172.17.0.6 dst 172.17.0.5
		proto esp spi 0xc8809352 reqid 2 mode tunnel
src 10.243.0.0/16 dst 172.17.0.6/32 
	dir fwd priority 375423 ptype main 
	tmpl src 172.17.0.5 dst 172.17.0.6
		proto esp reqid 2 mode tunnel
src 10.243.0.0/16 dst 172.17.0.6/32 
	dir in priority 375423 ptype main 
	tmpl src 172.17.0.5 dst 172.17.0.6
		proto esp reqid 2 mode tunnel
src 100.92.0.0/16 dst 172.17.0.5/32 
	dir out priority 375423 ptype main 
	tmpl src 172.17.0.6 dst 172.17.0.5
		proto esp spi 0xc8809352 reqid 2 mode tunnel
src 172.17.0.5/32 dst 100.92.0.0/16 
	dir fwd priority 375423 ptype main 
	tmpl src 172.17.0.5 dst 172.17.0.6
		proto esp reqid 2 mode tunnel
src 172.17.0.5/32 dst 100.92.0.0/16 
	dir in priority 375423 ptype main 
	tmpl src 172.17.0.5 dst 172.17.0.6
		proto esp reqid 2 mode tunnel
src 100.92.0.0/16 dst 100.93.0.0/16 
	dir out priority 383615 ptype main 
	tmpl src 172.17.0.6 dst 172.17.0.5
		proto esp spi 0xc8809352 reqid 2 mode tunnel
src 100.93.0.0/16 dst 100.92.0.0/16 
	dir fwd priority 383615 ptype main 
	tmpl src 172.17.0.5 dst 172.17.0.6
		proto esp reqid 2 mode tunnel
src 100.93.0.0/16 dst 100.92.0.0/16 
	dir in priority 383615 ptype main 
	tmpl src 172.17.0.5 dst 172.17.0.6
		proto esp reqid 2 mode tunnel
src 100.92.0.0/16 dst 10.243.0.0/16 
	dir out priority 383615 ptype main 
	tmpl src 172.17.0.6 dst 172.17.0.5
		proto esp spi 0xc8809352 reqid 2 mode tunnel
src 10.243.0.0/16 dst 100.92.0.0/16 
	dir fwd priority 383615 ptype main 
	tmpl src 172.17.0.5 dst 172.17.0.6
		proto esp reqid 2 mode tunnel
src 10.243.0.0/16 dst 100.92.0.0/16 
	dir in priority 383615 ptype main 
	tmpl src 172.17.0.5 dst 172.17.0.6
		proto esp reqid 2 mode tunnel
src 10.242.0.0/16 dst 172.17.0.5/32 
	dir out priority 375423 ptype main 
	tmpl src 172.17.0.6 dst 172.17.0.5
		proto esp spi 0xc8809352 reqid 2 mode tunnel
src 172.17.0.5/32 dst 10.242.0.0/16 
	dir fwd priority 375423 ptype main 
	tmpl src 172.17.0.5 dst 172.17.0.6
		proto esp reqid 2 mode tunnel
src 172.17.0.5/32 dst 10.242.0.0/16 
	dir in priority 375423 ptype main 
	tmpl src 172.17.0.5 dst 172.17.0.6
		proto esp reqid 2 mode tunnel
src 10.242.0.0/16 dst 100.93.0.0/16 
	dir out priority 383615 ptype main 
	tmpl src 172.17.0.6 dst 172.17.0.5
		proto esp spi 0xc8809352 reqid 2 mode tunnel
src 100.93.0.0/16 dst 10.242.0.0/16 
	dir fwd priority 383615 ptype main 
	tmpl src 172.17.0.5 dst 172.17.0.6
		proto esp reqid 2 mode tunnel
src 100.93.0.0/16 dst 10.242.0.0/16 
	dir in priority 383615 ptype main 
	tmpl src 172.17.0.5 dst 172.17.0.6
		proto esp reqid 2 mode tunnel
src 10.242.0.0/16 dst 10.243.0.0/16 
	dir out priority 383615 ptype main 
	tmpl src 172.17.0.6 dst 172.17.0.5
		proto esp spi 0xc8809352 reqid 2 mode tunnel
src 10.243.0.0/16 dst 10.242.0.0/16 
	dir fwd priority 383615 ptype main 
	tmpl src 172.17.0.5 dst 172.17.0.6
		proto esp reqid 2 mode tunnel
src 10.243.0.0/16 dst 10.242.0.0/16 
	dir in priority 383615 ptype main 
	tmpl src 172.17.0.5 dst 172.17.0.6
		proto esp reqid 2 mode tunnel
src 172.17.0.6/32 dst 172.17.0.11/32 
	dir out priority 367231 ptype main 
	tmpl src 172.17.0.6 dst 172.17.0.11
		proto esp spi 0xcb8289dd reqid 1 mode tunnel
src 172.17.0.11/32 dst 172.17.0.6/32 
	dir fwd priority 367231 ptype main 
	tmpl src 172.17.0.11 dst 172.17.0.6
		proto esp reqid 1 mode tunnel
src 172.17.0.11/32 dst 172.17.0.6/32 
	dir in priority 367231 ptype main 
	tmpl src 172.17.0.11 dst 172.17.0.6
		proto esp reqid 1 mode tunnel
src 172.17.0.6/32 dst 100.91.0.0/16 
	dir out priority 375423 ptype main 
	tmpl src 172.17.0.6 dst 172.17.0.11
		proto esp spi 0xcb8289dd reqid 1 mode tunnel
src 100.91.0.0/16 dst 172.17.0.6/32 
	dir fwd priority 375423 ptype main 
	tmpl src 172.17.0.11 dst 172.17.0.6
		proto esp reqid 1 mode tunnel
src 100.91.0.0/16 dst 172.17.0.6/32 
	dir in priority 375423 ptype main 
	tmpl src 172.17.0.11 dst 172.17.0.6
		proto esp reqid 1 mode tunnel
src 172.17.0.6/32 dst 10.241.0.0/16 
	dir out priority 375423 ptype main 
	tmpl src 172.17.0.6 dst 172.17.0.11
		proto esp spi 0xcb8289dd reqid 1 mode tunnel
src 10.241.0.0/16 dst 172.17.0.6/32 
	dir fwd priority 375423 ptype main 
	tmpl src 172.17.0.11 dst 172.17.0.6
		proto esp reqid 1 mode tunnel
src 10.241.0.0/16 dst 172.17.0.6/32 
	dir in priority 375423 ptype main 
	tmpl src 172.17.0.11 dst 172.17.0.6
		proto esp reqid 1 mode tunnel
src 100.92.0.0/16 dst 172.17.0.11/32 
	dir out priority 375423 ptype main 
	tmpl src 172.17.0.6 dst 172.17.0.11
		proto esp spi 0xcb8289dd reqid 1 mode tunnel
src 172.17.0.11/32 dst 100.92.0.0/16 
	dir fwd priority 375423 ptype main 
	tmpl src 172.17.0.11 dst 172.17.0.6
		proto esp reqid 1 mode tunnel
src 172.17.0.11/32 dst 100.92.0.0/16 
	dir in priority 375423 ptype main 
	tmpl src 172.17.0.11 dst 172.17.0.6
		proto esp reqid 1 mode tunnel
src 100.92.0.0/16 dst 100.91.0.0/16 
	dir out priority 383615 ptype main 
	tmpl src 172.17.0.6 dst 172.17.0.11
		proto esp spi 0xcb8289dd reqid 1 mode tunnel
src 100.91.0.0/16 dst 100.92.0.0/16 
	dir fwd priority 383615 ptype main 
	tmpl src 172.17.0.11 dst 172.17.0.6
		proto esp reqid 1 mode tunnel
src 100.91.0.0/16 dst 100.92.0.0/16 
	dir in priority 383615 ptype main 
	tmpl src 172.17.0.11 dst 172.17.0.6
		proto esp reqid 1 mode tunnel
src 100.92.0.0/16 dst 10.241.0.0/16 
	dir out priority 383615 ptype main 
	tmpl src 172.17.0.6 dst 172.17.0.11
		proto esp spi 0xcb8289dd reqid 1 mode tunnel
src 10.241.0.0/16 dst 100.92.0.0/16 
	dir fwd priority 383615 ptype main 
	tmpl src 172.17.0.11 dst 172.17.0.6
		proto esp reqid 1 mode tunnel
src 10.241.0.0/16 dst 100.92.0.0/16 
	dir in priority 383615 ptype main 
	tmpl src 172.17.0.11 dst 172.17.0.6
		proto esp reqid 1 mode tunnel
src 10.242.0.0/16 dst 172.17.0.11/32 
	dir out priority 375423 ptype main 
	tmpl src 172.17.0.6 dst 172.17.0.11
		proto esp spi 0xcb8289dd reqid 1 mode tunnel
src 172.17.0.11/32 dst 10.242.0.0/16 
	dir fwd priority 375423 ptype main 
	tmpl src 172.17.0.11 dst 172.17.0.6
		proto esp reqid 1 mode tunnel
src 172.17.0.11/32 dst 10.242.0.0/16 
	dir in priority 375423 ptype main 
	tmpl src 172.17.0.11 dst 172.17.0.6
		proto esp reqid 1 mode tunnel
src 10.242.0.0/16 dst 100.91.0.0/16 
	dir out priority 383615 ptype main 
	tmpl src 172.17.0.6 dst 172.17.0.11
		proto esp spi 0xcb8289dd reqid 1 mode tunnel
src 100.91.0.0/16 dst 10.242.0.0/16 
	dir fwd priority 383615 ptype main 
	tmpl src 172.17.0.11 dst 172.17.0.6
		proto esp reqid 1 mode tunnel
src 100.91.0.0/16 dst 10.242.0.0/16 
	dir in priority 383615 ptype main 
	tmpl src 172.17.0.11 dst 172.17.0.6
		proto esp reqid 1 mode tunnel
src 10.242.0.0/16 dst 10.241.0.0/16 
	dir out priority 383615 ptype main 
	tmpl src 172.17.0.6 dst 172.17.0.11
		proto esp spi 0xcb8289dd reqid 1 mode tunnel
src 10.241.0.0/16 dst 10.242.0.0/16 
	dir fwd priority 383615 ptype main 
	tmpl src 172.17.0.11 dst 172.17.0.6
		proto esp reqid 1 mode tunnel
src 10.241.0.0/16 dst 10.242.0.0/16 
	dir in priority 383615 ptype main 
	tmpl src 172.17.0.11 dst 172.17.0.6
		proto esp reqid 1 mode tunnel
src 0.0.0.0/0 dst 0.0.0.0/0 
	socket in priority 0 ptype main 
src 0.0.0.0/0 dst 0.0.0.0/0 
	socket out priority 0 ptype main 
src 0.0.0.0/0 dst 0.0.0.0/0 
	socket in priority 0 ptype main 
src 0.0.0.0/0 dst 0.0.0.0/0 
	socket out priority 0 ptype main 
src ::/0 dst ::/0 
	socket in priority 0 ptype main 
src ::/0 dst ::/0 
	socket out priority 0 ptype main 
src ::/0 dst ::/0 
	socket in priority 0 ptype main 
src ::/0 dst ::/0 
	socket out priority 0 ptype main 

```

```
[root@cluster2-worker submariner]# ip xfrm state
src 172.17.0.6 dst 172.17.0.5
	proto esp spi 0xc8809352 reqid 2 mode tunnel
	replay-window 0 flag af-unspec
	aead rfc4106(gcm(aes)) 0xae19a58907e0f6176aa08aff0e1e494162f71013 128
	encap type espinudp sport 4500 dport 4500 addr 0.0.0.0
	anti-replay context: seq 0x0, oseq 0xbd, bitmap 0x00000000
src 172.17.0.5 dst 172.17.0.6
	proto esp spi 0xc3dc3747 reqid 2 mode tunnel
	replay-window 0 flag af-unspec
	aead rfc4106(gcm(aes)) 0x6858f79901d9dd5a1f6efad09a9ab69a3b815c25 128
	encap type espinudp sport 4500 dport 4500 addr 0.0.0.0
	anti-replay esn context:
	 seq-hi 0x0, seq 0xbd, oseq-hi 0x0, oseq 0x0
	 replay_window 1024, bitmap-length 32
	 00000000 00000000 00000000 00000000 00000000 00000000 00000000 00000000 
	 00000000 00000000 00000000 00000000 00000000 00000000 00000000 00000000 
	 00000000 00000000 00000000 00000000 00000000 00000000 00000000 00000000 
	 00000000 00000000 1fffffff ffffffff ffffffff ffffffff ffffffff ffffffff 
src 172.17.0.6 dst 172.17.0.11
	proto esp spi 0xcb8289dd reqid 1 mode tunnel
	replay-window 0 flag af-unspec
	aead rfc4106(gcm(aes)) 0x7a08f349c610579709606ba621ea1f9598dd5551 128
	encap type espinudp sport 4500 dport 4500 addr 0.0.0.0
	anti-replay context: seq 0x0, oseq 0x0, bitmap 0x00000000
src 172.17.0.11 dst 172.17.0.6
	proto esp spi 0xc1e178c8 reqid 1 mode tunnel
	replay-window 0 flag af-unspec
	aead rfc4106(gcm(aes)) 0x5607d53126a8019575e4cff41056e09a8c3dad10 128
	encap type espinudp sport 4500 dport 4500 addr 0.0.0.0
	anti-replay esn context:
	 seq-hi 0x0, seq 0x0, oseq-hi 0x0, oseq 0x0
	 replay_window 1024, bitmap-length 32
	 00000000 00000000 00000000 00000000 00000000 00000000 00000000 00000000 
	 00000000 00000000 00000000 00000000 00000000 00000000 00000000 00000000 
	 00000000 00000000 00000000 00000000 00000000 00000000 00000000 00000000 
	 00000000 00000000 00000000 00000000 00000000 00000000 00000000 00000000 
```

```
# ip rule list
0:	from all lookup local
220:	from all lookup 220
32766:	from all lookup main
32767:	from all lookup default
```

**Comment by mangelajo** [comment]
Ok, looking at this with @skitt and @sridhargaddam we believe it's the missing xfrm policies. The routing rules from strongwan seem not to be important/necessary.

**Comment by skitt** [comment]
strongSwan automatically sets up host-to-subnet and subnet-to-host tunnels, along with all the crossed subnet tunnels; Libreswan only sets up the tunnels it’s asked to, and it wasn’t being told to set up host-to-subnet and subnet-to-host tunnels.

This is now fixed in #107.

**Comment by sridhargaddam** [comment]
@skitt @mangelajo, as discussed on the call, adding localendpoint and remoteendpoint to the left and rightsubnets is causing failures to the normal use-case of Pod to remotePod/Service connectivity. So, I reverted the change[*] and deployed local KIND clusters. 
As expected, connectivity from hostNetworkingPod on GatewayNode to remote cluster Pod/Svc was failing.

I see that we can address this in two ways.

**Solution1:**
Adding an explicit route to remoteCluster subnets as shown below, which we tried during the debug session.
`ip route add <remote Pod/SvcCIDR> via <remoteEndpointHostIP> dev eth0 proto static src <localCNIIfaceIP>`
Note: we can also use a specific table like 220, if required.

**Solution2:**
1. Use ipMark to mark remote traffic (i.e., remote Pod/Svc CIDRs)
`i.e., iptables -t nat <submariner-chain> -d remoteCidr -j MARK --set-mark <submarinerMark>`
2. Program iptable rule in SUBMARINER-POSTROUTING chain to modify the sourceIP of the traffic to localCNIInterfaceIP for packets that have the `<submarinerMark>`. This is something similar to what we are doing on non-Gw nodes but instead of using vx-submariner as an identifier we will be using Mark'ing.
`i.e., iptables -I SUBMARINER-POSTROUTING -p all -t nat -m mark --mark <submarinerMark> -j SNAT --to <localCNIIfaceIP>`

I verified both the solutions and they seem to work fine. We have to figure out the best one out of the two and modify the Submariner code accordingly as it might be applicable to many cableDrivers.

Just for notes: We did not have to do anything specific in case of Strongswan, since it was automatically adding routes (i.e., Solution1) but instead of using `<localCNIIfaceIP>`, it was using `<HostIPOfGatewayNode>`

[*] https://github.com/submariner-io/submariner/pull/107/files#diff-9ec02c815ead0158ec58d37dc0ad451bR123
