### ISSUE TITLE
Libreswan cable driver does not work with non-standard IPSEC ports

### ISSUE THREAD

**Issue by mangelajo** [submariner-io/submariner#683]
**What happened**:

When specifying non standard ipsec ports libreswan/pluto will target the standard 500 port / 4500..
```
12:05:50.405473 IP ip-10-166-76-227.us-east-2.compute.internal.501 > x.x.x.x.500: isakmp: parent_sa ikev2_init[I]
```

The connection of the gateways will not succeed (`kubectl get Gateways -A -o yaml`)

(see 501 in source but 500 in dst)

**What you expected to happen**:

(501 in source and **501** in dst)

**How to reproduce it (as minimally and precisely as possible)**:

Deploy submariner with the libreswan cabledriver and non-standard ports:

`subctl join broker-config.subm --cable-driver libreswan --ikeport 501 --nattport 4501

**Anything else we need to know?**:

**Environment**:
- Submariner version (use `subctl version`):
subctl version: v0.4.0
built from git ref: v0.4.0
- Install tools: subctl

**Comment by letoams** [comment]
With libreswan 3.33 (soon to be released) there will be the option for leftikeport= and rightikeport=
And whack will be able to specify: ipsec whack --name conn [...] --ikeport XXX  --to  [...]  --ikeport YYY    
The code for this is now in the git main branch (last commit via https://github.com/libreswan/libreswan/commit/e1cebcc60d6a3993ff0816e87291420a8ecab5cd

**Comment by mangelajo** [comment]
Added this one #746 to allow us to rebuild the submariner image with libreswan from git on fedora32

**Comment by mangelajo** [comment]
Ok I'm testing and this is what I see:
`
bash-5.0# tcpdump -i eth0 port 501 or port 4501 or port 500 or port 4501
tcpdump: verbose output suppressed, use -v or -vv for full protocol decode
listening on eth0, link-type EN10MB (Ethernet), capture size 262144 bytes
14:17:54.400083 IP cluster2-worker.4501 > ec2-18-224-183-91.us-east-2.compute.amazonaws.com.4501: UDP, length 1
14:17:54.400207 IP cluster2-worker.4501 > ec2-18-219-82-148.us-east-2.compute.amazonaws.com.4501: UDP, length 1
14:17:54.400257 IP cluster2-worker.4501 > ec2-18-224-183-91.us-east-2.compute.amazonaws.com.4501: UDP, length 1
14:17:54.401720 IP ec2-18-219-82-148.us-east-2.compute.amazonaws.com.4501 > cluster2-worker.4501: UDP, length 1
14:17:54.515729 IP ec2-18-224-183-91.us-east-2.compute.amazonaws.com.4501 > cluster2-worker.4501: UDP, length 1
14:17:54.516008 IP ec2-18-224-183-91.us-east-2.compute.amazonaws.com.4501 > cluster2-worker.4501: UDP, length 1
`

`
[majopela@bluehat subm-demo]$ subctl show connections
GATEWAY             CLUSTER         REMOTE IP       CABLE DRIVER            SUBNETS                                 STATUS
ip-10-0-41-177      cluster-a       10.0.41.177     libreswan               172.30.0.0/16, 10.128.0.0/14            connected
ip-10-0-13-102      clusterb        10.0.13.102     libreswan               172.31.0.0/16, 10.132.0.0/14            connected
`

`
[majopela@bluehat subm-demo]$ subctl verify --only connectivity cluster-a/auth/kubeconfig ../GolandProjects/submariner/output/kubeconfigs/kind-
config-cluster2   --verbose

 ... at this step I ran into some issues , I suspect one submariner-operator moved back my image to the default devel instead of libreswan-git
`

**Comment by mangelajo** [comment]
I have released a libreswan-git set of images which can be tested with:

`
curl -Ls https://raw.githubusercontent.com/submariner-io/submariner-operator/master/scripts/subctl/getsubctl.sh | VERSION=devel bash

.. etc .. etc ...

`

then

` 
subctl join --version libreswan-git --cable-driver libreswan --ikeport 501 --nattport 4501 broker-info.subm
`

**Comment by mangelajo** [comment]
```
Ran 10 of 22 Specs in 114.588 seconds
SUCCESS! -- 10 Passed | 0 Failed | 0 Pending | 12 Skipped
```

**Comment by manosnoam** [comment]
Thanks @mangelajo 
Using latest subctl-devel + calling `join --version libreswan-git --cable-driver libreswan` is now working on OSP (on-prem) cluster :)
Closing issue.
