### ISSUE TITLE
Traffic from hostNetwork on GW to remote pod does not use the right IP

### ISSUE THREAD

**Issue by mangelajo** [submariner-io/submariner#598]
**What happened**:

When connecting via hostNetwork to a remote pod/service, the source IP is the one on the IPSEC interface, and not the network plugin IP.

That means, that the remote GW will translate the IP to it's own network-plugin IP.

```
[root@cluster2-worker submariner]# ip a
4: weave: <BROADCAST,MULTICAST,UP,LOWER_UP> mtu 1376 qdisc noqueue state UP group default qlen 1000
    link/ether 06:ad:aa:22:af:22 brd ff:ff:ff:ff:ff:ff
    inet 10.242.0.1/16 brd 10.242.255.255 scope global weave

[root@cluster2-worker submariner]# ip r
default via 172.17.0.1 dev eth0 
10.242.0.0/16 dev weave proto kernel scope link src 10.242.0.1 
172.17.0.0/16 dev eth0 proto kernel scope link src 172.17.0.6 
240.0.0.0/8 dev vx-submariner proto kernel scope link src 240.17.0.6 

[root@cluster2-worker submariner]# ping 10.243.224.3
PING 10.243.224.3 (10.243.224.3) 56(84) bytes of data.
64 bytes from 10.243.224.3: icmp_seq=1 ttl=63 time=0.736 ms
64 bytes from 10.243.224.3: icmp_seq=2 ttl=63 time=0.497 ms
64 bytes from 10.243.224.3: icmp_seq=3 ttl=63 time=0.422 ms
```

Notice that the packet on the remote host is masqueraded into the cluster3 GW network-plugin ip: 10.243.0.1
```
bash-5.0# tcpdump -i eth0 -n
tcpdump: verbose output suppressed, use -v or -vv for full protocol decode
listening on eth0, link-type EN10MB (Ethernet), capture size 262144 bytes
16:34:47.465672 IP  > 10.243.224.3: ICMP echo request, id 112, seq 1, length 64
16:34:47.465755 IP 10.243.224.3 > 10.243.0.1: ICMP echo reply, id 112, seq 1, length 64
16:34:48.514014 IP 10.243.0.1 > 10.243.224.3: ICMP echo request, id 112, seq 2, length 64
16:34:48.514063 IP 10.243.224.3 > 10.243.0.1: ICMP echo reply, id 112, seq 2, length 64
```

**What you expected to happen**:

note the: **10.242.0.1**
```
bash-5.0# tcpdump -i eth0 -n
tcpdump: verbose output suppressed, use -v or -vv for full protocol decode
listening on eth0, link-type EN10MB (Ethernet), capture size 262144 bytes
16:34:47.465672 IP 10.242.0.1  > 10.243.224.3: ICMP echo request, id 112, seq 1, length 64
16:34:47.465755 IP 10.243.224.3 > 10.242.0.1: ICMP echo reply, id 112, seq 1, length 64
16:34:48.514014 IP 10.242.0.1 > 10.243.224.3: ICMP echo request, id 112, seq 2, length 64
16:34:48.514063 IP 10.243.224.3 > 10.242.0.1: ICMP echo reply, id 112, seq 2, length 64
```

**How to reproduce it (as minimally and precisely as possible)**:
- start a netshoot on gw node cluster2 with host network
- start a regular pod on cluster3, start tcpdump
- ping from the gw node netshoot to the regular pod
- inspect the src IP on the tcpdump

**Anything else we need to know?**:

**Environment**:
- strongswan cable driver

**Comment by mangelajo** [comment]
This can be fixed by modifying the routing rules generated by **strongswan** in


```
ip r del 10.243.0.0/16 via 172.17.0.5 dev eth0 proto static src 172.17.0.6  table 220
ip r add 10.243.0.0/16 via 172.17.0.5 dev eth0 proto static src 10.242.0.1  table 220

```

**Comment by sridhargaddam** [comment]
Even with Libreswan (supported via https://github.com/submariner-io/submariner/issues/592) this issue is seen. However, libreswan does not seem to program any routing rules in table220 (or any other table for remote subnets).

To preserve the sourceIP as the network plugin IP when traffic reaches destination Pod, the following helps.
```
ip r add 10.243.0.0/16 via 172.17.0.11 dev eth0 proto static src 10.242.224.0

where
10.243.0.0/16 -> remote subnet
172.17.0.11   -> remote Endpoint HostIP
10.242.224.0  -> CNIIfaceIP on the Gateway node
```

**Comment by mangelajo** [comment]
This is also probably true for wireguard @deanlorenz and @roytman :)

**Comment by mangelajo** [comment]
> Even with Libreswan (supported via #592) this issue is seen. However, libreswan does not seem to program any routing rules in table220 (or any other table for remote subnets).
> 
> To preserve the sourceIP as the network plugin IP when traffic reaches destination Pod, as mentioned in the previous comment, the following would help. Verified it manually.
> 
> ```
> ip r add 10.243.0.0/16 via 172.17.0.11 dev eth0 proto static src 10.242.224.0
> 
> where
> 10.243.0.0/16 -> remote subnet
> 172.17.0.11   -> remote Endpoint HostIP
> 10.242.224.0  -> CNIIfaceIP on the Gateway node
> ```

Yes although I think this is potentically cable driver specific, I believe we should move this responsibility to the cable drivers.

**Comment by deanlorenz** [comment]
@mangelajo @sridhargaddam :
- I am not sure why `via` is needed here -- WG driver does not use it, just the interface. Calling `via` might do an extra resolve if there is no L2 to remote endpoinIP (not sure). 
- I think the source IP for cross-cluster would be better handled NOT by the cable -- it is a visible address at the receiver side and logically should have same meaning regardless of cable
- I think it makes sense for the CNIIfaceIP to be provided to the cable driver as input -- probably by running `ip route get <some internal Pod>` to let the CNI decide the source IP
- Probably the same applies to EndpointIP:port -- these could be user configurable and should have the same API for all cables if possible

**Comment by sridhargaddam** [comment]
This is addressed via the following PR - https://github.com/submariner-io/submariner/issues/635
