### ISSUE TITLE
Vx-Submariner issue On Rancher RKE1 Setup

### ISSUE THREAD

**Issue by eremcan** [submariner-io/submariner#2841]
Hello Team,
I have installed 3 Cluster RKE1 as cluster setup. First cluster has 3 Nodes. Which I'm testing this intra cluster communitation on among these nodes. ( Second cluster is single node as broker, And third node is also single node which I'm making inter-cluster communication)
The issue is  With this Rancher setup, I m having issues with intra cluster communication for Cluster A. It looks like vx-submariner tunnels cannot make proper tunnel to communicate nodes among each other. 
 
Here is `subctl diagnose all` output below;

```
Cluster "cluster-c"
 ✓ Checking Submariner support for the Kubernetes version
 ✓ Kubernetes version "v1.27.6" is supported

 ✓ Non-Globalnet deployment detected - checking that cluster CIDRs do not overlap
 ✓ Checking DaemonSet "submariner-gateway"
 ✓ Checking DaemonSet "submariner-routeagent"
 ✓ Checking DaemonSet "submariner-metrics-proxy"
 ✓ Checking Deployment "submariner-lighthouse-agent"
 ✓ Checking Deployment "submariner-lighthouse-coredns"
 ✓ Checking the status of all Submariner pods
 ✓ Checking that gateway metrics are accessible from non-gateway nodes
 ✓ Skipping this check as it's a single node cluster

 ✓ Checking Submariner support for the CNI network plugin
 ✓ The detected CNI network plugin ("canal-flannel") is supported
 ✓ Checking gateway connections
 ✓ Checking Submariner support for the kube-proxy mode
 ✓ The kube-proxy mode is supported
 ✓ Checking that firewall configuration allows intra-cluster VXLAN traffic
 ✓ Skipping this check as it's a single node cluster

 ✓ Checking that services have been exported properly


Cluster "cluster-a"
 ✓ Checking Submariner support for the Kubernetes version
 ✓ Kubernetes version "v1.27.6" is supported

 ✓ Non-Globalnet deployment detected - checking that cluster CIDRs do not overlap
 ✓ Checking DaemonSet "submariner-gateway"
 ✓ Checking DaemonSet "submariner-routeagent"
 ✓ Checking DaemonSet "submariner-metrics-proxy"
 ✓ Checking Deployment "submariner-lighthouse-agent"
 ✓ Checking Deployment "submariner-lighthouse-coredns"
 ✓ Checking the status of all Submariner pods
 ✓ Checking that gateway metrics are accessible from non-gateway nodes

 ✓ Checking Submariner support for the CNI network plugin
 ✓ The detected CNI network plugin ("canal-flannel") is supported
 ✓ Checking gateway connections
 ✓ Checking Submariner support for the kube-proxy mode
 ✓ The kube-proxy mode is supported
 ✗ Checking that firewall configuration allows intra-cluster VXLAN traffic
 ✗ The tcpdump output from the sniffer pod does not contain the expected remote endpoint IP 10.47.0.0. Please check that your firewall configuration allows UDP/4800 traffic. Actual pod output:
tcpdump: verbose output suppressed, use -v[v]... for full protocol decode
listening on vx-submariner, link-type EN10MB (Ethernet), snapshot length 262144 bytes

0 packets captured
0 packets received by filter
0 packets dropped by kernel


 ✓ Checking that services have been exported properly

Cluster "cluster-b"
 ✓ Checking Submariner support for the Kubernetes version
 ✓ Kubernetes version "v1.27.6" is supported


 ⚠ Submariner connectivity feature is not installed

 ⚠ Submariner service discovery feature is not installed


Skipping inter-cluster firewall check as it requires two kubeconfigs. Please run "subctl diagnose firewall inter-cluster" command manually.

subctl version: v0.16.2
```

Here is ARP record of d4kcp-node01 of cluster A, which is primary node( Only etcd and controlplane) When diagnosing, 
```
root@d4kcp-node01:/home/stuab# tcpdump -i 'vx-submariner'
tcpdump: verbose output suppressed, use -v[v]... for full protocol decode
listening on vx-submariner, link-type EN10MB (Ethernet), snapshot length 262144 bytes
11:50:22.817224 ARP, Request who-has 240.168.210.201 tell 240.168.210.11, length 28
11:50:23.847219 ARP, Request who-has 240.168.210.201 tell 240.168.210.11, length 28
11:50:24.871200 ARP, Request who-has 240.168.210.201 tell 240.168.210.11, length 28
```
It doesnt get any answer for intra cluster vx-submariner ip for second node. 
```
root@d4kcp-node01:/home/stuab# arp
Address                  HWtype  HWaddress           Flags Mask            Iface
10.42.0.4                ether   5e:57:4b:1a:7b:0a   C                     cali599b869d91e
10.42.2.0                ether   a2:ae:b4:13:4d:95   CM                    flannel.1
d4kcp-node02             ether   00:50:56:01:0c:3a   C                     ens192
192.168.210.201          ether   00:50:56:01:07:a3   C                     ens192
192.168.210.1            ether   00:09:0f:09:00:0e   C                     ens192
192.168.210.202          ether   00:50:56:01:14:2f   C                     ens192
240.168.210.201                  (incomplete)                              vx-submariner
10.42.1.0                ether   52:d9:a3:90:4e:e9   CM                    flannel.1
```
So It does look like vx tunnel cannot be established in between Cluster A's nodes for some reason. I cannot detect any firewall related issues. 
First Node, 
```
root@d4kcp-node01:/home/stuab# ip addr show
REDACTED...
 vx-submariner: <BROADCAST,MULTICAST,UP,LOWER_UP> mtu 1450 qdisc noqueue state UNKNOWN group default
    link/ether 6e:45:79:40:b7:33 brd ff:ff:ff:ff:ff:ff
    inet 240.168.210.11/8 brd 240.255.255.255 scope global vx-submariner
       valid_lft forever preferred_lft forever
    inet6 fe80::10df:b8ff:fe25:41fe/64 scope link
       valid_lft forever preferred_lft forever
```
Second Node, 
```
root@kmb-poc01:~# ip addr show
REDACTED...
vx-submariner: <BROADCAST,MULTICAST,UP,LOWER_UP> mtu 1450 qdisc noqueue state UNKNOWN group default
    link/ether 6e:45:79:40:b7:33 brd ff:ff:ff:ff:ff:ff
    inet 240.168.210.201/8 brd 240.255.255.255 scope global vx-submariner
       valid_lft forever preferred_lft forever
    inet6 fe80::b08e:c7ff:fea3:76fc/64 scope link
       valid_lft forever preferred_lft forever

```
Third Node 
```
root@kmb-poc02:~# ip addr show
REDACTED...
27: vx-submariner: <BROADCAST,MULTICAST,UP,LOWER_UP> mtu 1450 qdisc noqueue state UNKNOWN group default
    link/ether 6e:45:79:40:b7:33 brd ff:ff:ff:ff:ff:ff
    inet 240.168.210.202/8 brd 240.255.255.255 scope global vx-submariner
       valid_lft forever preferred_lft forever
    inet6 fe80::7064:79ff:fe5e:8f7e/64 scope link
       valid_lft forever preferred_lft forever
```
So it looks like these addresses cannot be established among each other As much I can see on tcp Dump output.

I also wanted to note that This issue is only happening when Deploying a service when deploying non-cluster gateway. So, If I deploy a service into Cluster A' s  gateway node, I can access this service from Cluster C. This issue is only happening when accessing non-gateway node. Maybe about some intra cluster A internal communication. 

I 'm also sharing subctl gather all, 
[submariner gather all.zip] (https://github.com/submariner-io/submariner/files/13726669/submariner.gather.all.zip)

Any help would be appreciated. Thanks in advance.

**Comment by dfarrell07** [comment]
Hey @eremcan, thanks for the report! We don't have foks from Rancher contributing anymore and our active devs don't have experience with Rancher or access to RKE clusters to test with, but we can look a the pod logs and see if anything stands out.

**Comment by aswinsuryan** [comment]
From the diagnose output , it seems like 4800 is not open. How did you confirm there is no firewall rules blocking the traffic?
```
The tcpdump output from the sniffer pod does not contain the expected remote endpoint IP 10.47.0.0. Please check that your firewall configuration allows UDP/4800 traffic. Actual pod output:
tcpdump: verbose output suppressed, use -v[v]... for full protocol decode
listening on vx-submariner, link-type EN10MB (Ethernet), snapshot length 262144 bytes
```

**Comment by eremcan** [comment]
Hello @dfarrell07 @aswinsuryan 
In my iptable rules, There is a firewall rule applied all of my cluster Nodes below,
(Cluster A)

```
Chain SUBMARINER-INPUT (1 references)
num   pkts bytes target     prot opt in     out     source               destination         
1      185 16854 ACCEPT     17   --  *      *       0.0.0.0/0            0.0.0.0/0            udp dpt:4800
```
I couldn't realize some other rules which blocks 4800 in my iptable rules. 

So problem is might not about iptables AFAIK. Initially, I have clusters which are non-strict VM's(without any firewall or any limitations) and subctl and kubernetes RKE 1 cluster automatically applies their iptable rules according to its core needs. 
Please refer subctl gather all command that I have shared above. 
Additionally,
https://github.com/submariner-io/submariner/issues/2489 and https://github.com/submariner-io/submariner/issues/2660 are looks similar what I have been through. 
Any help would be appreciated.

**Comment by aswinsuryan** [comment]
In the underlay network? Is '4800'  open by default?

**Comment by eremcan** [comment]
@aswinsuryan There is no limitation or restriction on my cloud provider. There is just root any-any rule for any protocols.

**Comment by aswinsuryan** [comment]
Does the cluster have any other interface in 240 network? can you try ip route get for 240.0.0.1?  

Also is some other process using the port 4800?

In the route agent logs I could see this error 

```
[90m2023-12-19T13:05:19.500Z[0m [33mDBG[0m ../resource_syncer.go:561 ResourceSyncer       Syncer "Node watcher for routeagent_driver registry": transform function returned nil - not syncing - requeue: false
[90m2023-12-19T13:05:42.689Z[0m [33mDBG[0m ../resource_syncer.go:561 ResourceSyncer       Syncer "Node watcher for routeagent_driver registry": transform function returned nil - not syncing - requeue: false
[90m2023-12-19T13:06:13.243Z[0m [33mDBG[0m ../resource_syncer.go:561 ResourceSyncer       Syncer "Node watcher for routeagent_driver registry": transform function returned nil - not syncing - requeue: false
[90m2023-12-19T13:11:20.224Z[0m [33mDBG[0m ../resource_syncer.go:561 ResourceSyncer       Syncer "Node watcher for routeagent_driver registry": transform function returned nil - not syncing - requeue: false
[90m2023-12-19T13:16:28.261Z[0m [33mDBG[0m ../resource_syncer.go:561 ResourceSyncer       Syncer "Node watcher for routeagent_driver registry": transform function returned nil - not syncing - requeue: false
[90m2023-12-19T13:21:34.614Z[0m [33mDBG[0m ../resource_syncer.go:561 ResourceSyncer       Syncer "Node watcher for routeagent_driver registry": transform function returned nil - not syncing - requeue: false
[90m2023-12-19T13:26:42.534Z[0m [33mDBG[0m ../resource_syncer.go:561 ResourceSyncer       Syncer "Node watcher for routeagent_driver registry": transform function returned nil - not syncing - requeue: false
[90m2023-12-19T13:31:50.189Z[0m [33mDBG[0m ../resource_syncer.go:561 ResourceSyncer       Syncer "Node watcher for routeagent_driver registry": transform function returned nil - not syncing - requeue: false
```

@tpantelis  does this mean any connectivity issue?

**Comment by eremcan** [comment]
Hello,
Yes there is an interface starts with 240.
```
root@kmb-poc01:~# ip addr

26: vx-submariner: <BROADCAST,MULTICAST,UP,LOWER_UP> mtu 1450 qdisc noqueue state UNKNOWN group default
    link/ether 6e:45:79:40:b7:33 brd ff:ff:ff:ff:ff:ff
    inet 240.168.210.201/8 brd 240.255.255.255 scope global vx-submariner
       valid_lft forever preferred_lft forever
    inet6 fe80::b08e:c7ff:fea3:76fc/64 scope link
       valid_lft forever preferred_lft forever
...

root@kmb-poc01:~# ip route get 240.0.0.1
240.0.0.1 dev vx-submariner src 240.168.210.201 uid 0
    cache

root@kmb-poc01:~# sudo lsof -i :4800
root@kmb-poc01:~#
```
So It does Look like nothing used by 4800 and those interfaces set up properly. 
@tpantelis He wanted to ask a question above, but It was inline, so you might not alerted, any help would be appreciated.
Thanks in advance.

**Comment by aswinsuryan** [comment]
Can you try a tcpdump on the interface that connects the nodes so that we can make sure if the packets are leaving and reaching the other node?

**Comment by tpantelis** [comment]
Closing this issue for now. Please feel free to reopen if this is still an issue.
