### ISSUE TITLE
Submariner deployment on VPC-native GKE: traffic not forwarded to pods

### ISSUE THREAD

**Issue by etesami** [submariner-io/submariner#3593]
I’m exploring deploying Submariner on GKE, but I noticed that the [GKE quickstart guide](https://submariner.io/getting-started/quickstart/managed-kubernetes/gke/?utm_source=chatgpt.com)
 references version 0.8, which is quite outdated.

Specifically, I’m wondering whether Submariner is fully deployable on VPC-native GKE clusters, and if the absence of IP forwarding on GKE nodes could cause issues ([ip forwarding disabled on GKE](https://discuss.google.dev/t/why-is-ip-forwarding-disabled-for-gke-nodes-cant-find-a-way-to-enable-ip-forwarding-at-all/125340/5)).

In my testing, I deployed Submariner on a single-node VPC-native GKE cluster to connect it to a local cluster. Gateways appear to be connected correctly, and I can reach the gateway node from pods in the remote cluster. However, traffic does not get forwarded to pods that are running on the same gateway node.

GKE version: v1.32.6-gke.1060000
Submariner version: 0.21.0

Cluster setup: 1-node GKE cluster + local k3s cluster

Questions:

- Is missing IP forwarding on GKE nodes expected to cause traffic forwarding issues?
- Are there updated deployment instructions for Submariner on GKE?
- Any guidance on enabling intra-node traffic forwarding on GKE nodes when using Submariner?

Any insights or updated recommendations would be greatly appreciated.

**Comment by dfarrell07** [comment]
Thanks for the question @etesami. We don't try to keep the version number examples in the docs updated, but do update other details. Yossi is an SME that will look into this.

**Comment by yboaron** [comment]
Hi @etesami 

A.  Since you created a single-node cluster, there’s no need for intra-node routing. 
Submariner’s handles traffic in the egress direction, and for ingress (after the IPSec packet is decrypted), the CNI is responsible for forwarding the packet to its destination.
To make this work, rp_filter needs to be set to loose mode. Submariner code takes care of that for the supported CNIs,

Which CNI are you using?  If you are using GKE CNI , you might need to apply the rp_filter workaround described here: [GKE node preparation](https://submariner.io/getting-started/quickstart/managed-kubernetes/gke/#preparation-node-configuration)


B.  IIRC,  @VaishnaviRajulu  [successfully deployed Submariner on GKE](https://github.com/submariner-io/submariner/issues/3458) a few months ago ,    
@VaishnaviRajulu can you share how you deployed Submariner on GKE and provide some insights ?


Once you’ve addressed the issue, it would be great if you could submit PR to update GKE deployment section on Submariner documentation.

**Comment by VaishnaviRajulu** [comment]
Hi @etesami, 

I have deployed Submariner on GKE a few months ago, I had given the mentioned the steps in below mentioned issue. Please check.
[https://github.com/submariner-io/lighthouse/issues/1789](url)

**Comment by etesami** [comment]
Thank you, @yboaron and @VaishnaviRajulu 

The discussion mentioned above does not address the cluster specification.

I am still not sure if Submariner works with GKE in VPC-native mode. GKE supports two network models: the recommended VPC-native model and the legacy route-based model (referecnes [here](https://cloud.google.com/kubernetes-engine/docs/how-to/routes-based-cluster) and [here](http://cloud.google.com/kubernetes-engine/docs/concepts/alias-ips).

I provide more details below to reproduce the issue. Please let me know if I'm missing anything. The following setup creates a GKE cluster in VPC-native mode with two nodes. Despite my first comment, pods on the gateway node are reachable from pods in remote clusters but reachability to pods on nodes other than the gateway is not working. 

## GKE Setup

```bash
PROJECT_ID="replace-with-your-project"
SA_NAME="my-sa-name"  

# network with manual subnets creation
gcloud compute networks create my-vpc \
  --subnet-mode=custom \
  --project=$PROJECT_ID

# subnetwork
gcloud compute networks subnets create my-subnet \
  --network=my-vpc \
  --region=us-central1 \
  --range=10.17.0.0/17 \
  --secondary-range=my-pod-range=10.17.128.0/18,my-service-range=10.17.192.0/18	 \
  --project=$PROJECT_ID

# Create service account
gcloud iam service-accounts create $SA_NAME \
  --project=$PROJECT_ID

# Create service account key
SA_EMAIL="${SA_NAME}@${PROJECT_ID}.iam.gserviceaccount.com"
KEY_FILE="k8s-gke-sa-${SA_NAME}.json"
gcloud iam service-accounts keys create $KEY_FILE \
  --iam-account=$SA_EMAIL \
  --project=$PROJECT_ID

# Create cluster
gcloud container clusters create my-gke-cluster \
  --zone=us-central1-a \
  --num-nodes=2 \
  --enable-ip-alias \
  --network=my-vpc \
  --subnetwork=my-subnet \
  --cluster-secondary-range-name=my-pod-range \
  --services-secondary-range-name=my-service-range \
  --workload-pool=${PROJECT_ID}.svc.id.goog \
  --service-account=${SA_EMAIL}

# IAM policy binding
gcloud projects add-iam-policy-binding ${PROJECT_ID} \
  --member="serviceAccount:${SA_EMAIL}" \
  --role="roles/container.admin"

# Once ready:
gcloud container clusters get-credentials my-gke-cluster --location us-central1-a

# Firewall rules
gcloud compute firewall-rules create "allow-tcp-in" --allow=tcp \
  --direction=IN --source-ranges=10.0.0.0/8 --network=my-vpc
gcloud compute firewall-rules create "allow-udp-in" --allow=udp \
  --direction=IN --source-ranges=10.0.0.0/8 --network=my-vpc
gcloud compute firewall-rules create "allow-icmp-in" --allow=icmp \
  --direction=INGRESS --source-ranges=0.0.0.0/0 --network=my-vpc 

gcloud compute firewall-rules create "allow-tcp-out" --allow=tcp \
  --direction=OUT --destination-ranges=0.0.0.0/0 --network=my-vpc
gcloud compute firewall-rules create "allow-udp-out" --allow=udp \
  --direction=OUT --destination-ranges=0.0.0.0/0 --network=my-vpc

# Using Kubectl get nodes name and set one as gateway
NODE=gke-my-gke-cluster-default-pool-25552bc2-7jmz
kubectl label nodes $NODE "submariner.io/gateway=true"
```

## Submariner Join

Assuming you have a broker ready and deployed somewhere, I use Helm to deploy Submariner:

```bash
helm install submariner-operator submariner-latest/submariner-operator \
    --create-namespace \
    --namespace submariner-operator \
    --set ipsec.psk="${PSK}" \
    --set broker.server="${BROKER_URL}" \
    --set broker.token="${TOKEN}" \
    --set broker.namespace="${BROKER_NS}" \
    --set broker.ca="${CA}" \
    --set submariner.serviceDiscovery=false \
    --set submariner.cableDriver=wireguard \
    --set submariner.clusterId="${CLUSTER_ID}" \
    --set submariner.clusterCidr="${CLUSTER_CIDR}" \
    --set submariner.serviceCidr="${SERVICE_CIDR}" \
    --set submariner.natEnabled="true" \
    --set serviceAccounts.lighthouseAgent.create=true \
    --set serviceAccounts.lighthouseCoreDns.create=true \
    --kube-context $CTX
```

## Testing

Output of `subctl show all` and `subctl diagnose all`:

```bash
subctl show all --context $CTX
 ✓ Detecting broker(s)
 ✓ No brokers found

 ✓ Showing Connections
GATEWAY                        CLUSTER                    REMOTE IP       NAT   CABLE DRIVER   SUBNETS                       STATUS      RTT avg.
skycluster-control-plane       broker         abc.d.abc.abc   yes   wireguard      10.0.32.0/19, 10.0.0.0/19     connected   25.107953ms
example-kube-os-scinet-n9z2k   example-kube-os-scinet-j   abc.a.abc.abc   yes   wireguard      172.16.0.0/16, 10.16.0.0/17   connected   25.282758ms

 ✓ Showing Endpoints
CLUSTER                    ENDPOINT IP    PUBLIC IP        CABLE DRIVER   TYPE
gke                        10.17.0.3      abc.abc.abc.ad   wireguard      local
broker-skycluster          172.18.0.3     abc.d.abc.abc    wireguard      remote
example-kube-os-scinet-j   10.16.128.16   abc.d.abc.abc    wireguard      remote

 ✓ Showing Gateways
NODE                             HA STATUS   SUMMARY
gke-my-gke-cluster-default-poo   active      All connections (2) are established

 ✓ Showing Network details
    Discovered network details via Submariner:
        Network plugin:  generic
        Service CIDRs:   [10.17.192.0/18]
        Cluster CIDRs:   [10.17.128.0/18]

 ✓ Showing versions
COMPONENT                  REPOSITORY           CONFIGURED   RUNNING                     ARCH
submariner-gateway         quay.io/submariner   0.21.0       release-0.21-2f0111a4d643   amd64
submariner-routeagent      quay.io/submariner   0.21.0       release-0.21-2f0111a4d643   amd64
submariner-metrics-proxy   quay.io/submariner   0.21.0       release-0.21-f8d812e114a6   amd64
submariner-operator        quay.io/submariner   0.21.0       release-0.21-134dda265e13   amd64
```

```bash
subctl diagnose all --context $CTX
 ✓ Checking Submariner support for the Kubernetes version
 ✓ Kubernetes version "v1.33.3-gke.1136000" is supported
   
 ✓ Non-Globalnet deployment detected - checking that cluster CIDRs do not overlap
 ✓ Checking DaemonSet "submariner-gateway"
 ✓ Checking DaemonSet "submariner-routeagent"
 ✓ Checking DaemonSet "submariner-metrics-proxy"
 ✓ Checking the status of all Submariner pods
 ✓ Checking that gateway metrics are accessible from non-gateway nodes
 ✓ Skipping this check as it's a single node cluster
   
 ⚠ Checking Submariner support for the CNI network plugin
 ⚠ Submariner could not detect the CNI network plugin and is using ("generic") plugin. It may or may not work.
 ✓ Checking gateway connections
 ✓ Retrieving route agent connections
 ✓ Checking remote connections for route agent "gke-my-gke-cluster-default-pool-25552bc2-7jmz"
 ✓ Checking Submariner support for the kube-proxy mode
 ✓ The kube-proxy mode is supported
 ✓ Checking that firewall configuration allows intra-cluster VXLAN traffic
 ✓ Skipping this check as it's a single node cluster
   
 ⚠ Submariner service discovery feature is not installed
```

With this setup, you cannot reach pods on nodes other than the gateway.

**Comment by etesami** [comment]
Adding to the setup above, please note that `rp_filter` workaround is already applied but there is still no reachability to pods on nodes other than the gateway. For reference, here is the command:

```bash
NODES=(
  gke-my-gke-cluster-default-pool-25552bc2-7jmz
  gke-my-gke-cluster-default-pool-1a143183-abcd
)

for NODE in "${NODES[@]}"; do
  kubectl --v=4 run netshoot-hostmount-$(uuidgen) --overrides='{
    "spec": {
      "hostNetwork": true,
      "nodeName": "'$NODE'",
      "containers": [{
        "args": [
          "/bin/bash", "-c",
          "echo 2 > /proc/sys/net/ipv4/conf/all/rp_filter"
        ],
        "stdin": true,
        "stdinOnce": true,
        "terminationMessagePath": "/dev/termination-log",
        "terminationMessagePolicy": "File",
        "tty": true,
        "securityContext": {
          "allowPrivilegeEscalation": true,
          "privileged": true,
          "runAsUser": 0,
          "capabilities": {
            "add": ["ALL"]
          }
        },
        "name": "netshoot-hostmount",
        "image": "nicolaka/netshoot",
        "volumeMounts": [{
          "mountPath": "/host",
          "name": "host-slash",
          "readOnly": true
        }]
      }],
      "restartPolicy": "Never",
      "volumes": [{
        "hostPath": {
          "path": "/",
          "type": ""
        },
        "name": "host-slash"
      }]
    }
  }' --image nicolaka/netshoot -- /bin/bash
done
```

**Comment by etesami** [comment]
You may also face an issue when deploying Submariner related to the failure in finding the service IP range, as described [here](https://github.com/submariner-io/submariner-operator/issues/3627). I also want to confirm that if you follow the steps above but create the cluster using legacy route-based networking, Submariner works as expected. Hence, I suspect this issue is due to the disabled IP forwarding feature in VPC-native GKE mode.

**Comment by VaishnaviRajulu** [comment]
Hi @etesami 

My GKE cluster is created with VPC-native traffic routing. I found this information under details section of my GKE cluster

**VPC-native traffic routing | Enabled**

So, GKE works with Submariner in VPC-native traffic routing

**Comment by yboaron** [comment]
@etesami 

> Adding to the setup above, please note that rp_filter workaround is already applied but there is still no reachability to pods on nodes other than the gateway.

A. Isn’t your GKE cluster a single-node ? Maybe I'm missing something  — on which cluster are you seeing the issue with lack of reachability to pods on non-gateway nodes?

B. I also noticed you have 3 clusters in your clusterset [1]. do you see the same connectivity issue when testing between the other two clusters as well?


[1] 
gke                        10.17.0.3      abc.abc.abc.ad   wireguard      local
broker-skycluster          172.18.0.3     abc.d.abc.abc    wireguard      remote
example-kube-os-scinet-j   10.16.128.16   abc.d.abc.abc    wireguard      remote

**Comment by yboaron** [comment]
@etesami Any updates on this issue?

**Comment by etesami** [comment]
I’m sorry, I’ve had other priorities recently. Based on my latest observations, the issue appears to be related to GKE VPC-native mode and the automatically inserted routes in the nodes’ routing tables. This causes intra-cluster traffic to bypass the VXLAN tunnels and instead be routed through the default gateway. Since IP forwarding is disabled in VPC-native mode, traffic from gateway nodes cannot reach other nodes. I’ll aim to provide details for reproducing the environment within the next couple of weeks.

**Comment by yboaron** [comment]
OK, thanks for the update.

**Comment by dfarrell07** [comment]
Bump, any feedback or can we close this?

**Comment by etesami** [comment]
Thanks for the reminder, @dfarrell07. My observations still confirm that the issue persists. The problem appears to be related to intra-cluster traffic flow between the gateway node and worker nodes when using generic plugin. Specifically, the gateway node does not forward traffic to the vx-submariner interface; instead, it sends the traffic to the local gateway via the node’s ens4 interface. Because packet forwarding is disabled, this traffic never reaches the worker node and therefore never reaches the target pod.

Below are the detailed observations. 

## Environment

```bash
subctl show connections --context gcp-central
 ✓ Showing Connections
GATEWAY                          CLUSTER                    REMOTE IP       NAT   CABLE DRIVER   SUBNETS                         STATUS      RTT avg.      
skycluster-control-plane         broker-skycluster          abc.a.abc.abc   yes   wireguard      10.0.32.0/19, 10.0.0.0/19       connected   24.483826ms   
gke-ex1-kube-gcp-east1-8-defau   ex1-kube-gcp-east1-l58dv   35.227.91.58    yes   wireguard      172.17.0.0/16, 10.17.192.0/18   connected   32.710687ms   
ip-10-40-164-236.ec2.internal    aws-kube-cluster1-wchhw    44.196.56.0     yes   wireguard      10.255.0.0/16, 10.40.128.0/17   connected   30.129576ms   

# Second cluster
subctl show connections --context gcp-east
 ✓ Showing Connections
GATEWAY                          CLUSTER                    REMOTE IP        NAT   CABLE DRIVER   SUBNETS                         STATUS      RTT avg.      
gke-ex1-kube-gcp-central-defau   ex1-kube-gcp-central-cqz   136.111.23.125   yes   wireguard      172.18.0.0/16, 10.18.192.0/18   connected   32.566325ms   
skycluster-control-plane         broker-skycluster          abc.a.abc.abc    yes   wireguard      10.0.32.0/19, 10.0.0.0/19       connected   34.983748ms   
ip-10-40-164-236.ec2.internal    aws-kube-cluster1-wchhw    44.196.56.0      yes   wireguard      10.255.0.0/16, 10.40.128.0/17   connected   18.95776ms    

```

## Test Cases

1. The gateway node can reach a pod running on a worker node within the same cluster at IP (10.17.194.6); notice that traffic is routed via ens4 (not via vx-submariner):

```bash
gke-gcp-east1-8-default-pool-7050f12f-p7kg:~$ ping 10.17.194.6
PING 10.17.194.6 (10.17.194.6) 56(84) bytes of data.
64 bytes from 10.17.194.6: icmp_seq=1 ttl=63 time=1.23 ms
64 bytes from 10.17.194.6: icmp_seq=2 ttl=63 time=0.346 ms
64 bytes from 10.17.194.6: icmp_seq=3 ttl=63 time=0.319 ms

# Notice that traffic is routed via ens4 (not via vx-submariner)
gke-gcp-east1-8-default-pool-7050f12f-p7kg:~$ ip route get 10.17.194.6
10.17.194.6 via 10.17.128.1 dev ens4 src 10.17.128.3 uid 1000 
    cache 
```

2. The same behavior occurs for traffic arriving from remote clusters, the traffic is routed through ens4:

```bash
gke-gcp-east1-8-default-pool-7050f12f-p7kg:~$ sudo tcpdump -lni any "(arp or icmp) and host 10.17.194.6"
tcpdump: data link type LINUX_SLL2
tcpdump: verbose output suppressed, use -v[v]... for full protocol decode
listening on any, link-type LINUX_SLL2 (Linux cooked v2), snapshot length 262144 bytes
03:10:14.859043 submariner In  IP 10.18.194.11 > 10.17.194.6: ICMP echo request, id 7, seq 1, length 64
03:10:14.859100 ens4  Out IP 10.18.194.11 > 10.17.194.6: ICMP echo request, id 7, seq 1, length 64
03:10:15.864200 submariner In  IP 10.18.194.11 > 10.17.194.6: ICMP echo request, id 7, seq 2, length 64
03:10:15.864230 ens4  Out IP 10.18.194.11 > 10.17.194.6: ICMP echo request, id 7, seq 2, length 64
```

## Additional Notes

Reviewing the code confirms that the gateway does not install routing rules for intra-cluster traffic:

https://github.com/submariner-io/submariner/blob/1f59bd046ea0a1330dbd9fe5c84bf618c616b871/pkg/routeagent_driver/handlers/kubeproxy/routes_iface.go#L271-L276

This explains why the issue does not occur in environments such as EKS or GKE in Route mode, the key difference is that packet forwarding is not disabled there.

I hope this clarifies the root cause of the issue.

**Comment by yboaron** [comment]
Hi @etesami ,

You are absolutely correct regarding Submariner's traffic flow design: the inter-cluster traffic is intentionally asymmetric.

Egress: Handled by Submariner (routing traffic from a local Pod out through the Gateway).

Ingress: Handled by the CNI (routing traffic arriving at the Gateway Node toward the destination Pod).

As detailed in the [linked issue](https://github.com/submariner-io/submariner/issues/2541#issuecomment-1584438003), Submariner relies on the CNI's routing capability for ingress traffic to ensure the packet (with source IP from remote cluster's CIDR and dest IP from local cluster's CIDR) reaches the target pod.

Could the current limitation is related to the fact that the source IP address is from the remote cluster's CIDR (i.e., not from the local VPC range, maybe the packet is dropped by some firewall rule  because src IP is outside the local VPC's CIDR )?

**Comment by dfarrell07** [comment]
Closing for now, feel free to re-open if this is still relevant.

**Comment by anupamdialpad** [comment]
We are facing this same issue that @etesami described. Traffic from an on-prem cluster doesn't reach a pod running on non-gateway node in GKE standard cluster (VPC native enabled cluster). We have configured the firewall rules & rp filtering as mentioned in https://submariner.io/getting-started/quickstart/managed-kubernetes/gke/#preparation-node-configuration. 
tcpdump shows SYN packets reaching the gateway node in GKE, from the pod running in the on-prem cluster. Below is a sample log from tcpdump
```
12:38:25.872255 eth0  In  IP 10.78.1.55.51256 > 34.118.225.100.1234: Flags [S], seq 3221392816, win 64240, options [mss 1398,sackOK,TS val 3437075305 ecr 0,nop,wscale 8], length 0
12:38:25.872366 eth0  Out IP 10.78.1.55.51256 > 10.162.128.7.1234: Flags [S], seq 3221392816, win 64240, options [mss 1398,sackOK,TS val 3437075305 ecr 0,nop,wscale 8], length 0
```
`10.78.1.55` is the IP of pod in on-prem cluster
`34.118.225.100` is the service IP in GKE cluster
`10.162.128.7` is the IP of pod in GKE cluster behind the service IP
GKE version: 1.34.4-gke.1193000
submariner version: 0.22

The SYN packet leaving the gateway node above doesn't reach the non-gateway node as seen from the tcpdump output on a non-gateway node. We don't have ip overlaps in our setup and we are not running Globalnet. 

@VaishnaviRajulu can you please create the setup again and confirm that this works? Would be great if you could please document the steps in this issue or share a video recording of the setup

**Comment by anupamdialpad** [comment]
We tried the similar approach mentioned in https://github.com/submariner-io/submariner-website/blob/devel/src/content/getting-started/quickstart/managed-kubernetes/gke/_index.md#cluster-creation i.e. We created 2 GKE clusters in the same project and same VPC and followed all the steps mentioned in the link. Still traffic from non gateway node in 1 GKE cluster doesn't reach to non gateway node in the other GKE cluster.
It seemed to be dropped at the Gateway node of 2nd GKE cluster. Not sure what else to try at this point. @dfarrell07/ @yboaron  Please reopen the ticket and help unblock this usecase.

**Comment by sivagurudialpad** [comment]
We are trying to use submariner to connect Baremetal and GKE clusters. We are repeatedly running into this same issue for both the BM <--> GKE usecase as well as the GKE <--> GKE usecase (both GKE clusters are in the same VPC for our initial tests). 
Most of our clusters are GKE, and we would like to be able to use submariner to enable a multi-cluster solution to manage them all.
@yboaron , @dfarrell07 It would be great if you could provide guidance on how to move forward with this use case. Are you able to provide any workarounds to help unblock us on this issue ?

@VaishnaviRajulu , @etesami -  I wanted to check with you if you were able to make any progress. Are you able to provide any workarounds to help unblock us on this issue ?
