### ISSUE TITLE
[kindnet] external-net e2e dataplane test failure

### ISSUE THREAD

**Issue by sridhargaddam** [submariner-io/submariner#2215]
**What happened**:
One of the e2e test-cases associated with external-net test suite is failing with KIND clusters running with KINDNet CNI.
The test-case is trying to validate a use-case where we have a Service in a remote cluster and we are trying to connect to the service from the ext-app.

```

STEP: Creating kubernetes clients
STEP: Creating submariner clients
[external-dataplane] Connectivity when connected from a non-gateway-cluster when a pod connects via TCP to/from a remote service when the pod is not on a gateway 
  should be able to connect from/to an external app to/from a pod in a cluster
  /go/src/github.com/submariner-io/submariner/test/external/dataplane/connectivity.go:89
STEP: Creating namespace objects with basename "ext-dataplane"
STEP: Generated namespace "e2e-tests-ext-dataplane-bmhd5" in cluster "cluster2" to execute the tests in
STEP: Creating namespace "e2e-tests-ext-dataplane-bmhd5" in cluster "cluster1"
STEP: Creating a pod and a service in cluster "cluster2"
STEP: Sending an http request from external app "172.117.0.4" to "100.67.218.74" in the cluster "cluster2"
Dec 19 14:17:39.987: INFO: Error attempting to run [curl -m 3 100.67.218.74:1234/e2e-tests-ext-dataplane-bmhd5cluster2]: exit status 28
Dec 19 14:17:48.300: INFO: Error attempting to run [curl -m 3 100.67.218.74:1234/e2e-tests-ext-dataplane-bmhd5cluster2]: exit status 28
Dec 19 14:17:53.286: INFO: Error attempting to run [curl -m 3 100.67.218.74:1234/e2e-tests-ext-dataplane-bmhd5cluster2]: exit status 28
Dec 19 14:17:58.332: INFO: Error attempting to run [curl -m 3 100.67.218.74:1234/e2e-tests-ext-dataplane-bmhd5cluster2]: exit status 28

...
....

[Fail] [external-dataplane] Connectivity when connected from a non-gateway-cluster when a pod connects via TCP to/from a remote service when the pod is not on a gateway [It] should be able to connect from/to an external app to/from a pod in a cluster 
/go/src/github.com/submariner-io/submariner/vendor/github.com/submariner-io/shipyard/test/e2e/framework/docker.go:105
``` 

**What you expected to happen**:
All e2e tests should pass.

**Anything else we need to know?**:

**Environment**:
- Diagnose information (use `subctl diagnose all`): KIND e2e test-suite
- Others: Seen with submariner 0.14.1 as well as devel version.

**Comment by sridhargaddam** [comment]
Submariner external-net test suite includes the following resources.
1. Two KIND clusters, named cluster1 and cluster2 connected via Submariner
2. The e2e external-net suite, creates an additional docker network (named pseudo-ext)
2. It creates a docker container which is connected to the pseudo-ext network which is used to simulate an external server/VM.
3. It modifies the cluster1 Gateway node to include an interface on the pseudo-ext (i.e., cluster1 Gateway node has two interfaces, one connected to `kind` network and the other connected to the `pseudo-ext` network)
4. As part of test-case validation, the e2e suite creates a service in cluster2 with backend pod on a non-Gateway node.
5. It then tries to connect from the ext-app to the service in cluster2

![9](https://user-images.githubusercontent.com/6574656/208662910-7615dfdc-9055-4bc8-9646-9b438467f71c.png)

Analysis:

On debugging the issue, when we try to curl from the `ext-app` to the service in `cluster2`, ideally the packets should take the following path.

ext-app ---> Cluster1 Gateway node ----> IPsec tunnel ---> Cluster2 Gateway node ---> Cluster2 worker node (backendpod)

Currently, it is seen that traffic from ext-app is going fine until it reaches Cluster2 Gateway node. But when Cluster2 Gateway node tries to forward the traffic to the backend pod in Cluster2-worker-node, the sourceIP of the traffic is getting modified to the default Gateway IP (i.e., 172.18.0.1) of the `kind` network. Because of this, the return traffic is forwarded to the 172.18.0.1 IP and not to the Cluster2-Gateway node. So the end to end communication fails.
Note: If the ext-app tries to connect to the backendPod IP directly everything works fine.

Steps:

From the ext-app, lets do a curl to the serviceIP in Cluster2.
ext-app IP: 172.117.0.4
Cluster1 Gateway node IPs: eth0 (172.18.0.4), eth1 (172.117.0.3)
Cluster2 Gateway node: eth0 (172.18.0.7)
Cluster2 worker node where the backend pod is scheduled: eth0 (172.18.0.6)
ServiceIP: 100.67.224.36
Backend PodIP: 10.131.2.6

```
[root@18af34e41ac8 /]# curl -m 3 100.67.224.36:1234
curl: (28) Connection timed out after 2001 milliseconds
[root@18af34e41ac8 /]# 
```

Tcpdump on Cluster2-Gateway-node.
```
root@cluster2-worker:/# tcpdump -len -i any port 1234
11:22:29.962144 eth0  In  ifindex 44 02:42:ac:12:00:04 ethertype IPv4 (0x0800), length 80: 172.117.0.4.39574 > 100.67.224.36.1234: Flags [S], seq 555840217, win 64240, options [mss 1406,sackOK,TS val 2357275471 ecr 0,nop,wscale 7], length 0
11:22:29.962202 eth0  Out ifindex 44 02:42:ac:12:00:07 ethertype IPv4 (0x0800), length 80: 172.117.0.4.39574 > 10.131.2.6.1234: Flags [S], seq 555840217, win 64240, options [mss 1406,sackOK,TS val 2357275471 ecr 0,nop,wscale 7], length 0
11:22:30.982315 eth0  In  ifindex 44 02:42:ac:12:00:04 ethertype IPv4 (0x0800), length 80: 172.117.0.4.39574 > 100.67.224.36.1234: Flags [S], seq 555840217, win 64240, options [mss 1406,sackOK,TS val 2357276491 ecr 0,nop,wscale 7], length 0
11:22:30.982356 eth0  Out ifindex 44 02:42:ac:12:00:07 ethertype IPv4 (0x0800), length 80: 172.117.0.4.39574 > 10.131.2.6.1234: Flags [S], seq 555840217, win 64240, options [mss 1406,sackOK,TS val 2357276491 ecr 0,nop,wscale 7], length 0

```

Tcpdump on Cluster2-Worker node:

```
root@cluster2-worker2:/# tcpdump -len -i any port 1234
tcpdump: data link type LINUX_SLL2
tcpdump: verbose output suppressed, use -v[v]... for full protocol decode
listening on any, link-type LINUX_SLL2 (Linux cooked v2), snapshot length 262144 bytes
11:22:29.962262 eth0  In  ifindex 42 02:42:ac:12:00:07 ethertype IPv4 (0x0800), length 80: 172.18.0.1.39574 > 10.131.2.6.1234: Flags [S], seq 555840217, win 64240, options [mss 1406,sackOK,TS val 2357275471 ecr 0,nop,wscale 7], length 0
11:22:29.962306 vetha9f99a43 Out ifindex 8 ca:76:f1:59:17:ce ethertype IPv4 (0x0800), length 80: 172.18.0.1.39574 > 10.131.2.6.1234: Flags [S], seq 555840217, win 64240, options [mss 1406,sackOK,TS val 2357275471 ecr 0,nop,wscale 7], length 0
11:22:29.962349 vetha9f99a43 In  ifindex 8 5e:ce:ea:5a:df:53 ethertype IPv4 (0x0800), length 80: 10.131.2.6.1234 > 172.18.0.1.39574: Flags [S.], seq 1412300440, ack 555840218, win 65160, options [mss 1460,sackOK,TS val 1420375509 ecr 2357275471,nop,wscale 7], length 0
11:22:29.962370 eth0  Out ifindex 42 02:42:ac:12:00:06 ethertype IPv4 (0x0800), length 80: 10.131.2.6.1234 > 172.18.0.1.39574: Flags [S.], seq 1412300440, ack 555840218, win 65160, options [mss 1460,sackOK,TS val 1420375509 ecr 2357275471,nop,wscale 7], length 0
11:22:30.982105 vetha9f99a43 In  ifindex 8 5e:ce:ea:5a:df:53 ethertype IPv4 (0x0800), length 80: 10.131.2.6.1234 > 172.18.0.1.39574: Flags [S.], seq 1412300440, ack 555840218, win 65160, options [mss 1460,sackOK,TS val 1420376529 ecr 2357275471,nop,wscale 7], length 0
11:22:30.982136 eth0  Out ifindex 42 02:42:ac:12:00:06 ethertype IPv4 (0x0800), length 80: 10.131.2.6.1234 > 172.18.0.1.39574: Flags [S.], seq 1412300440, ack 555840218, win 65160, options [mss 1460,sackOK,TS val 1420376529 ecr 2357275471,nop,wscale 7], length 0
11:22:30.982392 eth0  In  ifindex 42 02:42:ac:12:00:07 ethertype IPv4 (0x0800), length 80: 172.18.0.1.39574 > 10.131.2.6.1234: Flags [S], seq 555840217, win 64240, options [mss 1406,sackOK,TS val 2357276491 ecr 0,nop,wscale 7], length 0
11:22:30.982406 vetha9f99a43 Out ifindex 8 ca:76:f1:59:17:ce ethertype IPv4 (0x0800), length 80: 172.18.0.1.39574 > 10.131.2.6.1234: Flags [S], seq 555840217, win 64240, options [mss 1406,sackOK,TS val 2357276491 ecr 0,nop,wscale 7], length 0
11:22:30.982427 vetha9f99a43 In  ifindex 8 5e:ce:ea:5a:df:53 ethertype IPv4 (0x0800), length 80: 10.131.2.6.1234 > 172.18.0.1.39574: Flags [S.], seq 1412300440, ack 555840218, win 65160, options [mss 1460,sackOK,TS val 1420376530 ecr 2357275471,nop,wscale 7], length 0
11:22:30.982439 eth0  Out ifindex 42 02:42:ac:12:00:06 ethertype IPv4 (0x0800), length 80: 10.131.2.6.1234 > 172.18.0.1.39574: Flags [S.], seq 1412300440, ack 555840218, win 65160, options [mss 1460,sackOK,TS val 1420376530 ecr 2357275471,nop,wscale 7], length 0
11:22:33.030067 vetha9f99a43 In  ifindex 8 5e:ce:ea:5a:df:53 ethertype IPv4 (0x0800), length 80: 10.131.2.6.1234 > 172.18.0.1.39574: Flags [S.], seq 1412300440, ack 555840218, win 65160, options [mss 1460,sackOK,TS val 1420378577 ecr 2357275471,nop,wscale 7], length 0
11:22:33.030113 eth0  Out ifindex 42 02:42:ac:12:00:06 ethertype IPv4 (0x0800), length 80: 10.131.2.6.1234 > 172.18.0.1.39574: Flags [S.], seq 1412300440, ack 555840218, win 65160, options [mss 1460,sackOK,TS val 1420378577 ecr 2357275471,nop,wscale 7], length 0
```

Interestingly, if we look at the output of tcpdump in the Cluster2-Worker node, the sourceIP of the traffic gets modified to `172.18.0.1` and not the ext-app IP (which is `172.117.0.4`). However when the traffic was leaving the Cluster2-Gateway node, the sourceIP was correct (`172.117.0.4`). So, as next step, I did a tcpdump on the Host/Laptop where the who setup is running.

```
[sgaddam@localhost ~]$ sudo tcpdump -len -i br-87caa7c2984a port 1234
dropped privs to tcpdump
tcpdump: verbose output suppressed, use -v[v]... for full protocol decode
listening on br-87caa7c2984a, link-type EN10MB (Ethernet), snapshot length 262144 bytes
16:52:29.962257 02:42:ac:12:00:07 > 02:42:ac:12:00:06, ethertype IPv4 (0x0800), length 74: 172.117.0.4.39574 > 10.131.2.6.search-agent: Flags [S], seq 555840217, win 64240, options [mss 1406,sackOK,TS val 2357275471 ecr 0,nop,wscale 7], length 0
16:52:29.962396 02:42:ac:12:00:06 > 02:42:fd:93:16:19, ethertype IPv4 (0x0800), length 74: 10.131.2.6.search-agent > 172.117.0.4.39574: Flags [S.], seq 1412300440, ack 555840218, win 65160, options [mss 1460,sackOK,TS val 1420375509 ecr 2357275471,nop,wscale 7], length 0
16:52:30.982253 02:42:ac:12:00:06 > 02:42:fd:93:16:19, ethertype IPv4 (0x0800), length 74: 10.131.2.6.search-agent > 172.117.0.4.39574: Flags [S.], seq 1412300440, ack 555840218, win 65160, options [mss 1460,sackOK,TS val 1420376529 ecr 2357275471,nop,wscale 7], length 0
16:52:30.982389 02:42:ac:12:00:07 > 02:42:ac:12:00:06, ethertype IPv4 (0x0800), length 74: 172.117.0.4.39574 > 10.131.2.6.search-agent: Flags [S], seq 555840217, win 64240, options [mss 1406,sackOK,TS val 2357276491 ecr 0,nop,wscale 7], length 0
16:52:30.982455 02:42:ac:12:00:06 > 02:42:fd:93:16:19, ethertype IPv4 (0x0800), length 74: 10.131.2.6.search-agent > 172.117.0.4.39574: Flags [S.], seq 1412300440, ack 555840218, win 65160, options [mss 1460,sackOK,TS val 1420376530 ecr 2357275471,nop,wscale 7], length 0
16:52:33.030164 02:42:ac:12:00:06 > 02:42:fd:93:16:19, ethertype IPv4 (0x0800), length 74: 10.131.2.6.search-agent > 172.117.0.4.39574: Flags [S.], seq 1412300440, ack 555840218, win 65160, options [mss 1460,sackOK,TS val 1420378577 ecr 2357275471,nop,wscale 7], length 0

```

Surprisingly the tcpdump from the Host/Laptop does not show any translation of the sourceIPs, which looks wierd.
But the connection tracking entries do indicate that the sourceIP was modified on the Host.

```
[sgaddam@localhost ~]$ sudo conntrack -L | grep 1234
tcp      6 29 SYN_RECV src=172.117.0.4 dst=10.131.2.6 sport=39264 dport=1234 src=10.131.2.6 dst=172.18.0.1 sport=1234 dport=39264 mark=0 use=1
tcp      6 88 SYN_SENT src=172.117.0.4 dst=100.67.224.36 sport=39264 dport=1234 [UNREPLIED] src=100.67.224.36 dst=172.117.0.4 sport=1234 dport=39264 mark=0 use=1
conntrack v1.4.5 (conntrack-tools): 134 flow entries have been shown.

```

**Comment by sridhargaddam** [comment]
Based on the analysis so far, it looks like we may have to make changes outside of Submariner to get the e2e external-net test-case passing.

**Comment by dfarrell07** [comment]
I found one run where this job didn't fail, interestingly.

https://github.com/submariner-io/submariner/actions/runs/4591595402/jobs/8107888026

**Comment by sridhargaddam** [comment]
This is still relevant.
